id,title,Description,price,image,featured,active,slug,stockcode,timestamp
2984,LUNCH BAG APPLE DESIGN,LUNCH BAG APPLE DESIGN,4.95,,0,1,SMALL-TAHITI-BEACH-BAG,46776E,23/12/2020 00:00
2985,CHARLOTTE BAG APPLES DESIGN,CHARLOTTE BAG APPLES DESIGN,1.65,,0,1,PINK-FEATHERS-CURTAIN,84750A,03/03/2020 00:00
2986,CHARLOTTE BAG ALPHABET  DESIGN,CHARLOTTE BAG ALPHABET  DESIGN,0.55,,0,1,WOVEN-BUBBLE-GUM-CUSHION-COVER,78033,20/01/2020 00:00
2987,KIDS CUTLERY SPACEBOY ,KIDS CUTLERY SPACEBOY ,4.95,,0,1,WOVEN-ROSE-GARDEN-CUSHION-COVER-,21395,15/05/2020 00:00
2988,KIDS CUTLERY DOLLY GIRL ,KIDS CUTLERY DOLLY GIRL ,3.75,,0,1,WOVEN-SUNSET-CUSHION-COVER-,37351,20/11/2020 00:00
2989,LUNCH BAG VINTAGE LEAF DESIGN,LUNCH BAG VINTAGE LEAF DESIGN,3.75,,0,1,PADS-TO-MATCH-ALL-CUSHIONS,37488A,11/08/2020 00:00
2990,HARDMAN MUG 3 ASSORTED,HARDMAN MUG 3 ASSORTED,2.1,,0,1,SQUARECUSHION-COVER-PINK-UNION-JACK,85030,02/06/2020 00:00
2991,S/2 BEACH HUT TREASURE CHESTS,S/2 BEACH HUT TREASURE CHESTS,4.25,,0,1,3-BIRDS-CANVAS-SCREEN,21637,09/10/2020 00:00
2992,SMALL TAHITI BEACH BAG,SMALL TAHITI BEACH BAG,1.65,,0,1,LARGE-DECO-JEWELLERY-STAND,47344B,05/08/2020 00:00
2993,PINK FEATHERS CURTAIN,PINK FEATHERS CURTAIN,0.85,,0,1,PASTEL-BLUE-PHOTO-ALBUM-,46126A,13/02/2020 00:00
2994,WOVEN BUBBLE GUM CUSHION COVER,WOVEN BUBBLE GUM CUSHION COVER,4.95,,0,1,HEART-BEADED-TRELLIS-DECORATION,37330,24/03/2020 00:00
2995,WOVEN ROSE GARDEN CUSHION COVER ,WOVEN ROSE GARDEN CUSHION COVER ,3.75,,0,1,GEMSTONE-CHANDELIER-T-LIGHT-HOLDER,90036F,31/01/2020 00:00
2996,WOVEN SUNSET CUSHION COVER ,WOVEN SUNSET CUSHION COVER ,4.25,,0,1,BEADED-CHANDELIER-T-LIGHT-HOLDER,90030B,19/04/2020 00:00
2997,PADS TO MATCH ALL CUSHIONS,PADS TO MATCH ALL CUSHIONS,4.95,,0,1,SMALL-DECO-JEWELLERY-STAND,90131,24/09/2020 00:00
2998,SQUARECUSHION COVER PINK UNION JACK,SQUARECUSHION COVER PINK UNION JACK,5.95,,0,1,ALUMINIUM-STAMPED-HEART,85224,27/07/2020 00:00
2999,3 BIRDS CANVAS SCREEN,3 BIRDS CANVAS SCREEN,1.25,,0,1,DOUBLE-CERAMIC-PARLOUR-HOOK,23077,23/09/2020 00:00
3000,LARGE DECO JEWELLERY STAND,LARGE DECO JEWELLERY STAND,2.55,,0,1,ZINC-SWEETHEART-WIRE-LETTER-RACK,23076,14/02/2020 00:00
3001,PASTEL BLUE PHOTO ALBUM ,PASTEL BLUE PHOTO ALBUM ,2.1,,0,1,PARLOUR-CERAMIC-WALL-HOOK,23078,23/11/2020 00:00
3002,HEART BEADED TRELLIS DECORATION,HEART BEADED TRELLIS DECORATION,2.55,,0,1,GEORGIAN-TRINKET-BOX,21770,05/11/2020 00:00
3003,GEMSTONE CHANDELIER T-LIGHT HOLDER,GEMSTONE CHANDELIER T-LIGHT HOLDER,2.55,,0,1,CROCHET-WHITE-RABBIT-KEYRING-,47013C,29/09/2020 00:00
3004,BEADED CHANDELIER T-LIGHT HOLDER,BEADED CHANDELIER T-LIGHT HOLDER,4.95,,0,1,SET-OF-12-ROSE-BOTANICAL-T-LIGHTS,84548,24/05/2020 00:00
3005,SMALL DECO JEWELLERY STAND,SMALL DECO JEWELLERY STAND,2.1,,0,1,BLUE-CAT-BISCUIT-BARREL-PINK-HEART,84796A,29/07/2020 00:00
3006,ALUMINIUM STAMPED HEART,ALUMINIUM STAMPED HEART,2.1,,0,1,TRIPLE-HOOK-ANTIQUE-IVORY-ROSE,15030,22/02/2020 00:00
3007,DOUBLE CERAMIC PARLOUR HOOK,DOUBLE CERAMIC PARLOUR HOOK,2.1,,0,1,VINTAGE-EMBOSSED-HEART,21897,02/11/2020 00:00
3008,ZINC SWEETHEART WIRE LETTER RACK,ZINC SWEETHEART WIRE LETTER RACK,2.1,,0,1,GOLD-WINE-GOBLET,23159,16/07/2020 00:00
3009,PARLOUR CERAMIC WALL HOOK,PARLOUR CERAMIC WALL HOOK,2.95,,0,1,GOLD-APERITIF-GLASS,23154,04/12/2020 00:00
3010,GEORGIAN TRINKET BOX,GEORGIAN TRINKET BOX,2.95,,0,1,IVORY-CHANDELIER-T-LIGHT-HOLDER,23156,21/05/2020 00:00
3011,CROCHET WHITE RABBIT KEYRING ,CROCHET WHITE RABBIT KEYRING ,1.65,,0,1,FLOWERS-CHANDELIER-T-LIGHT-HOLDER,23155,05/05/2020 00:00
3012,SET OF 12 ROSE BOTANICAL T-LIGHTS,SET OF 12 ROSE BOTANICAL T-LIGHTS,1.69,,0,1,TRIPLE-WIRE-HOOK-IVORY-HEART,84569C,05/04/2020 00:00
3013,BLUE CAT BISCUIT BARREL PINK HEART,BLUE CAT BISCUIT BARREL PINK HEART,2.95,,0,1,TRIPLE-WIRE-HOOK-PINK-HEART,23158,02/02/2020 00:00
3014,TRIPLE HOOK ANTIQUE IVORY ROSE,TRIPLE HOOK ANTIQUE IVORY ROSE,2.95,,0,1,SMALL-ZINC-HEART-WALL-ORGANISER,85145,19/12/2020 00:00
3015,VINTAGE EMBOSSED HEART,VINTAGE EMBOSSED HEART,1.65,,0,1,SMALL-IVORY-HEART-WALL-ORGANISER,21839,18/05/2020 00:00
3016,GOLD WINE GOBLET,GOLD WINE GOBLET,2.1,,0,1,MARIE-ANTOIENETT-TRINKET-BOX-GOLD,85028S,13/02/2020 00:00
3017,GOLD APERITIF GLASS,GOLD APERITIF GLASS,4.25,,0,1,IVORY-SWEETHEART-WIRE-LETTER-RACK-,85028L,23/07/2020 00:00
3018,IVORY CHANDELIER T-LIGHT HOLDER,IVORY CHANDELIER T-LIGHT HOLDER,3.75,,0,1,LARGE-ZINC-HEART-WALL-ORGANISER,21270,24/07/2020 00:00
3019,FLOWERS CHANDELIER T-LIGHT HOLDER,FLOWERS CHANDELIER T-LIGHT HOLDER,3.75,,0,1,LARGE-IVORY-HEART-WALL-ORGANISER,85017A,07/01/2020 00:00
3020,TRIPLE WIRE HOOK IVORY HEART,TRIPLE WIRE HOOK IVORY HEART,2.55,,0,1,60-GOLD-AND-SILVER-FAIRY-CAKE-CASES,90164A,17/08/2020 00:00
3021,TRIPLE WIRE HOOK PINK HEART,TRIPLE WIRE HOOK PINK HEART,3.39,,0,1,SINGLE-ANTIQUE-ROSE-HOOK-IVORY,90124A,30/06/2020 00:00
3022,SMALL ZINC HEART WALL ORGANISER,SMALL ZINC HEART WALL ORGANISER,2.75,,0,1,MINIATURE-ANTIQUE-ROSE-HOOK-IVORY,90124C,07/09/2020 00:00
3023,SMALL IVORY HEART WALL ORGANISER,SMALL IVORY HEART WALL ORGANISER,4.95,,0,1,ZINC-T-LIGHT-HOLDER-STARS-SMALL,21847,21/05/2020 00:00
3024,MARIE ANTOIENETT TRINKET BOX GOLD,MARIE ANTOIENETT TRINKET BOX GOLD,4.95,,0,1,IVORY-WIRE-KITCHEN-ORGANISER,90099,01/08/2020 00:00
3025,IVORY SWEETHEART WIRE LETTER RACK ,IVORY SWEETHEART WIRE LETTER RACK ,1.06,,0,1,IVORY-WIRE-SWEETHEART-LETTER-TRAY,84743C,02/06/2020 00:00
3026,LARGE ZINC HEART WALL ORGANISER,LARGE ZINC HEART WALL ORGANISER,1.06,,0,1,SINGLE-WIRE-HOOK-PINK-HEART,23157,19/02/2020 00:00
3027,LARGE IVORY HEART WALL ORGANISER,LARGE IVORY HEART WALL ORGANISER,1.06,,0,1,SINGLE-WIRE-HOOK-IVORY-HEART,90014C,28/05/2020 00:00
3028,60 GOLD AND SILVER FAIRY CAKE CASES,60 GOLD AND SILVER FAIRY CAKE CASES,1.06,,0,1,IVORY-SWEETHEART-SOAP-DISH,35649,04/11/2020 00:00
3029,SINGLE ANTIQUE ROSE HOOK IVORY,SINGLE ANTIQUE ROSE HOOK IVORY,4.95,,0,1,ZINC-T-LIGHT-HOLDER-STAR-LARGE,35809B,14/11/2020 00:00
3030,MINIATURE ANTIQUE ROSE HOOK IVORY,MINIATURE ANTIQUE ROSE HOOK IVORY,6.95,,0,1,16-PIECE-CUTLERY-SET-PANTRY-DESIGN,84686,22/08/2020 00:00
3031,ZINC T-LIGHT HOLDER STARS SMALL,ZINC T-LIGHT HOLDER STARS SMALL,2.1,,0,1,PINK-BUTTERFLY-CUSHION-COVER,22104,26/04/2020 00:00
3032,IVORY WIRE KITCHEN ORGANISER,IVORY WIRE KITCHEN ORGANISER,2.55,,0,1,ZINC-WIRE-SWEETHEART-LETTER-TRAY,20821,17/11/2020 00:00
3033,IVORY WIRE SWEETHEART LETTER TRAY,IVORY WIRE SWEETHEART LETTER TRAY,1.65,,0,1,PAINTED-LIGHTBULB-RAINBOW-DESIGN,84877A,07/05/2020 00:00
3034,SINGLE WIRE HOOK PINK HEART,SINGLE WIRE HOOK PINK HEART,3.39,,0,1,LILAC-VOTIVE-CANDLE,84875D,25/04/2020 00:00
3035,SINGLE WIRE HOOK IVORY HEART,SINGLE WIRE HOOK IVORY HEART,3.39,,0,1,TEATIME-GEL-PENS-ASST,22106,23/11/2020 00:00
3036,IVORY SWEETHEART SOAP DISH,IVORY SWEETHEART SOAP DISH,7.65,,0,1,ORANGE-WHT-FUSCHIA-STONES-NECKLACE,84872A,08/12/2020 00:00
3037,ZINC T-LIGHT HOLDER STAR LARGE,ZINC T-LIGHT HOLDER STAR LARGE,35.75,,0,1,WHITE-PINK-MINI-CRYSTALS-NECKLACE,90024D,11/07/2020 00:00
3038,16 PIECE CUTLERY SET PANTRY DESIGN,16 PIECE CUTLERY SET PANTRY DESIGN,4.25,,0,1,COTE-DAZURE-NECKLACE,23255,29/03/2020 00:00
3039,PINK BUTTERFLY CUSHION COVER,PINK BUTTERFLY CUSHION COVER,1.85,,0,1,WHITE-ROSEBUD-PEARL-BRACELET,22039,28/05/2020 00:00
3040,ZINC WIRE SWEETHEART LETTER TRAY,ZINC WIRE SWEETHEART LETTER TRAY,1.85,,0,1,PINK-ROSEBUD-PEARL-NECKLACE,90001C,07/01/2020 00:00
3041,PAINTED LIGHTBULB RAINBOW DESIGN,PAINTED LIGHTBULB RAINBOW DESIGN,2.55,,0,1,WHITE-ROSEBUD-PEARL-NECKLACE,90025A,17/11/2020 00:00
3042,LILAC VOTIVE CANDLE,LILAC VOTIVE CANDLE,3.39,,0,1,ST-TROPEZ-NECKLACE,90142D,01/04/2020 00:00
3043,TEATIME GEL PENS ASST,TEATIME GEL PENS ASST,2.75,,0,1,RIVIERA-NECKLACE,37487B,29/04/2020 00:00
3044,ORANGE/WHT/FUSCHIA STONES NECKLACE,ORANGE/WHT/FUSCHIA STONES NECKLACE,4.95,,0,1,CRACKED-GLAZE-NECKLACE-RED,84839,17/02/2020 00:00
3045,WHITE/PINK MINI CRYSTALS NECKLACE,WHITE/PINK MINI CRYSTALS NECKLACE,4.95,,0,1,EDWARDIAN-PHOTO-FRAME,23201,16/06/2020 00:00
3046,COTE D'AZURE NECKLACE,COTE D'AZURE NECKLACE,1.06,,0,1,MAXWELL-2-TONE-BLUE-60-PAGE-PHOTO-A,23207,23/08/2020 00:00
3047,WHITE  ROSEBUD PEARL BRACELET,WHITE  ROSEBUD PEARL BRACELET,1.06,,0,1,MISTLETOE-HEART-WREATH-CREAM,23199,18/06/2020 00:00
3048,PINK ROSEBUD & PEARL NECKLACE,PINK ROSEBUD & PEARL NECKLACE,1.06,,0,1,HANGING-ENGRAVED-METAL-HEART,23206,29/12/2020 00:00
3049,WHITE ROSEBUD & PEARL NECKLACE,WHITE ROSEBUD & PEARL NECKLACE,1.06,,0,1,BLUE-TABLE-RUN-FLOWER,23204,30/06/2020 00:00
3050,ST TROPEZ NECKLACE,ST TROPEZ NECKLACE,4.95,,0,1,BLUE-STRIPES-SHOULDER-BAG,23208,15/03/2020 00:00
3051,RIVIERA NECKLACE,RIVIERA NECKLACE,6.95,,0,1,BLUE-CHECK-BAG-W-HANDLE-34X20CM,37468,08/01/2020 00:00
3052,CRACKED GLAZE NECKLACE RED,CRACKED GLAZE NECKLACE RED,2.1,,0,1,LASER-CUT-MULTI-STRAND-NECKLACE,84689,11/06/2020 00:00
3053,EDWARDIAN PHOTO FRAME,EDWARDIAN PHOTO FRAME,2.55,,0,1,REGENCY-SUGAR-TONGS,84856S,31/01/2020 00:00
3054,MAXWELL 2 TONE BLUE 60 PAGE PHOTO A,MAXWELL 2 TONE BLUE 60 PAGE PHOTO A,1.65,,0,1,DOORMAT-KEEP-CALM-AND-COME-IN,44242B,16/03/2020 00:00
3055,MISTLETOE HEART WREATH CREAM,MISTLETOE HEART WREATH CREAM,3.39,,0,1,DOORMAT-VINTAGE-LEAVES-DESIGN-,46776A,24/05/2020 00:00
3056,HANGING ENGRAVED METAL HEART,HANGING ENGRAVED METAL HEART,3.39,,0,1,GREEN-ENAMEL-FLOWER-RING,46776F,03/01/2020 00:00
3057,BLUE TABLE RUN FLOWER,BLUE TABLE RUN FLOWER,7.65,,0,1,RED-ENAMEL-FLOWER-RING,46776D,16/07/2020 00:00
3058,BLUE STRIPES SHOULDER BAG,BLUE STRIPES SHOULDER BAG,35.75,,0,1,PURPLE-ENAMEL-FLOWER-RING,PADS,24/06/2020 00:00
3059,BLUE CHECK BAG W HANDLE 34X20CM,BLUE CHECK BAG W HANDLE 34X20CM,4.25,,0,1,CD-WALL-TIDY-BLUE-OFFICE,84731,26/02/2020 00:00
3060,LASER CUT MULTI STRAND NECKLACE,LASER CUT MULTI STRAND NECKLACE,1.85,,0,1,REGENCY-TEA-STRAINER,16202B,01/02/2020 00:00
3061,REGENCY SUGAR TONGS,REGENCY SUGAR TONGS,1.85,,0,1,SMALL-ZINC-GLASS-CANDLEHOLDER,23060,19/07/2020 00:00
3062,DOORMAT KEEP CALM AND COME IN,DOORMAT KEEP CALM AND COME IN,1.25,,0,1,GOLD-FLOWER-CUSHION-COVER-,23153,01/03/2020 00:00
3063,DOORMAT VINTAGE LEAVES DESIGN ,DOORMAT VINTAGE LEAVES DESIGN ,1.25,,0,1,SET-OF-10-LANTERNS-FAIRY-LIGHT-STAR,23073,03/11/2020 00:00
3064,GREEN ENAMEL FLOWER RING,GREEN ENAMEL FLOWER RING,1.25,,0,1,PAPER-LANTERN-7-POINT-SNOW-STAR,84549,16/08/2020 00:00
3065,RED ENAMEL FLOWER RING,RED ENAMEL FLOWER RING,1.25,,0,1,PAPER-LANTERN-9-POINT-SNOW-STAR,21614,09/01/2020 00:00
3066,PURPLE ENAMEL FLOWER RING,PURPLE ENAMEL FLOWER RING,3.75,,0,1,PAPER-LANTERN-9-POINT-SNOW-STAR-,84576,09/07/2020 00:00
3067,CD WALL TIDY BLUE OFFICE,CD WALL TIDY BLUE OFFICE,2.95,,0,1,CINDERELLA-CHANDELIER-,23146,09/04/2020 00:00
3068,REGENCY TEA STRAINER,REGENCY TEA STRAINER,1.25,,0,1,BLING-KEY-RING-STAND,20823,06/01/2020 00:00
3069,FRENCH FLORAL CUSHION COVER ,FRENCH FLORAL CUSHION COVER ,1.65,,0,1,MISTLETOE-HEART-WREATH-GREEN,20827,25/07/2020 00:00
3070,SMALL ZINC/GLASS CANDLEHOLDER,SMALL ZINC/GLASS CANDLEHOLDER,0.65,,0,1,WHITE-3-FRAME-BIRDS-AND-TREE-,23055,03/06/2020 00:00
3071,GOLD FLOWER CUSHION COVER ,GOLD FLOWER CUSHION COVER ,1.65,,0,1,FRENCH-LATTICE-CUSHION-COVER-,23140,11/04/2020 00:00
3072,SET OF 10 LANTERNS FAIRY LIGHT STAR,SET OF 10 LANTERNS FAIRY LIGHT STAR,0.65,,0,1,WRAP-SUMMER-ROSE-DESIGN,23141,04/04/2020 00:00
3073,PAPER LANTERN 7 POINT SNOW STAR,PAPER LANTERN 7 POINT SNOW STAR,1.65,,0,1,FRENCH-PAISLEY-CUSHION-COVER,23135,26/07/2020 00:00
3074,PAPER LANTERN 9 POINT SNOW STAR,PAPER LANTERN 9 POINT SNOW STAR,0.65,,0,1,REGENCY-TEA-SPOON,23132,16/09/2020 00:00
3075,PAPER LANTERN 9 POINT SNOW STAR ,PAPER LANTERN 9 POINT SNOW STAR ,0.65,,0,1,REGENCY-CAKE-FORK,23152,16/02/2020 00:00
3076,CINDERELLA CHANDELIER ,CINDERELLA CHANDELIER ,1.25,,0,1,REGENCY-CAKE-SLICE,23134,31/10/2020 00:00
3077,BLING KEY RING STAND,BLING KEY RING STAND,1.25,,0,1,ANTIQUE-IVORY-WIRE-BOWL-SMALL,23133,06/01/2020 00:00
3078,MISTLETOE HEART WREATH GREEN,MISTLETOE HEART WREATH GREEN,1.49,,0,1,MINITURE-ANTIQUE-ROSE-HOOK-IVORY,84990,28/08/2020 00:00
3079,WHITE 3 FRAME BIRDS AND TREE ,WHITE 3 FRAME BIRDS AND TREE ,0.85,,0,1,PINK-FLOCK-PHOTO-FRAME-,23147,15/09/2020 00:00
3080,FRENCH LATTICE CUSHION COVER ,FRENCH LATTICE CUSHION COVER ,0.85,,0,1,ZINC-WIRE-KITCHEN-ORGANISER,23144,28/07/2020 00:00
3081,WRAP SUMMER ROSE DESIGN,WRAP SUMMER ROSE DESIGN,0.85,,0,1,FOOD-COVER-WITH-BEADS-SET-2-,23142,03/09/2020 00:00
3082,FRENCH PAISLEY CUSHION COVER,FRENCH PAISLEY CUSHION COVER,0.85,,0,1,SPOTTY-BUNTING,23136,17/03/2020 00:00
3083,FRENCH LATTICE CUSHION COVER ,FRENCH LATTICE CUSHION COVER ,0.85,,0,1,EDWARDIAN-HEART-PHOTO-FRAME,23139,25/10/2020 00:00
3084,REGENCY TEA SPOON,REGENCY TEA SPOON,0.85,,0,1,ZINC-SWEETHEART-SOAP-DISH,23138,29/12/2020 00:00
3085,REGENCY CAKE FORK,REGENCY CAKE FORK,1.65,,0,1,CRYSTAL-STUD-EARRINGS-CLEAR-DISPLAY,23150,02/04/2020 00:00
3086,REGENCY CAKE SLICE,REGENCY CAKE SLICE,1.65,,0,1,PAPER-LANTERN-9-POINTSNOW-STAR,23137,29/11/2020 00:00
3087,ANTIQUE IVORY WIRE BOWL SMALL,ANTIQUE IVORY WIRE BOWL SMALL,1.25,,0,1,PAPER-LANTERN-9-POINT-HOLLY-STAR-40,79144C,15/08/2020 00:00
3088,MINITURE ANTIQUE ROSE HOOK IVORY,MINITURE ANTIQUE ROSE HOOK IVORY,0.85,,0,1,PAPER-LANTERN-5-POINT-STAR-MOON-30,72024U,22/07/2020 00:00
3089,PINK FLOCK PHOTO FRAME ,PINK FLOCK PHOTO FRAME ,1.65,,0,1,PAPER-LANTERN-6-POINT-SNOW-STAR,16049,03/02/2020 00:00
3090,ZINC WIRE KITCHEN ORGANISER,ZINC WIRE KITCHEN ORGANISER,0.85,,0,1,PINK-AND-WHITE-CHRISTMAS-TREE-120CM,90135,14/02/2020 00:00
3091,FOOD COVER WITH BEADS SET 2 ,FOOD COVER WITH BEADS SET 2 ,0.65,,0,1,BUNTING-SPOTTY-,90138,13/01/2020 00:00
3092,SPOTTY BUNTING,SPOTTY BUNTING,3.75,,0,1,POLYESTER-FILLER-PAD-60x40cm,90159,23/03/2020 00:00
3093,EDWARDIAN HEART PHOTO FRAME,EDWARDIAN HEART PHOTO FRAME,3.75,,0,1,BLUE-DISCO-HANDBAG,90164B,04/05/2020 00:00
3094,ZINC SWEETHEART SOAP DISH,ZINC SWEETHEART SOAP DISH,2.95,,0,1,LUNCH-BAG-DOILEY-PATTERN-,90163A,17/12/2020 00:00
3095,CRYSTAL STUD EARRINGS CLEAR DISPLAY,CRYSTAL STUD EARRINGS CLEAR DISPLAY,2.95,,0,1,JUMBO-BAG-PEARS,90163B,07/07/2020 00:00
3096,PAPER LANTERN 9 POINT SNOW STAR,PAPER LANTERN 9 POINT SNOW STAR,1.25,,0,1,JUMBO-BAG-DOILEY-PATTERNS,90158,08/02/2020 00:00
3097,PAPER LANTERN 9 POINT HOLLY STAR 40,PAPER LANTERN 9 POINT HOLLY STAR 40,2.95,,0,1,MONTANA-DIAMOND-CLUSTER-EARRINGS,90157,25/06/2020 00:00
3098,PAPER LANTERN 5 POINT STAR MOON 30,PAPER LANTERN 5 POINT STAR MOON 30,2.95,,0,1,MARIE-ANTOINETTE-TRINKET-BOX-GOLD,90051,25/02/2020 00:00
3099,PAPER LANTERN 6 POINT SNOW STAR,PAPER LANTERN 6 POINT SNOW STAR,1.95,,0,1,MARIE-ANTOINETTE-TRINKET-BOX-SILVER,23069,08/02/2020 00:00
3100,PINK AND WHITE CHRISTMAS TREE 120CM,PINK AND WHITE CHRISTMAS TREE 120CM,1.45,,0,1,JUMBO-BAG-VINTAGE-LEAF,16244B,23/05/2020 00:00
3101,"BUNTING , SPOTTY ","BUNTING , SPOTTY ",2.95,,0,1,PAPER-LANTERN-9-POINT-HOLLY-STAR-L,23067,17/11/2020 00:00
3102,POLYESTER FILLER PAD 60x40cm,POLYESTER FILLER PAD 60x40cm,1.65,,0,1,PAPER-LANTERN-9-POINT-DELUXE-STAR,47341B,15/11/2020 00:00
3103,BLUE DISCO HANDBAG,BLUE DISCO HANDBAG,1.65,,0,1,PAPER-LANTERN-5-POINT-SEQUIN-STAR,62097B,06/02/2020 00:00
3104,LUNCH BAG DOILEY PATTERN ,LUNCH BAG DOILEY PATTERN ,2.1,,0,1,PAPER-LANTERN-9-POINT-HOLLY-STAR-S,62043B,12/10/2020 00:00
3105,JUMBO BAG PEARS,JUMBO BAG PEARS,2.1,,0,1,PAPER-LANTERN-9-POINT-HOLLY-STAR-23,90021,08/03/2020 00:00
3106,JUMBO BAG DOILEY PATTERNS,JUMBO BAG DOILEY PATTERNS,2.1,,0,1,PAPER-LANTERN-5-POINT-STUDDED-STAR,23163,21/10/2020 00:00
3107,MONTANA DIAMOND CLUSTER EARRINGS,MONTANA DIAMOND CLUSTER EARRINGS,1.65,,0,1,FOOD-COVER-WITH-BEADS-SET-2-SIZES,23284,18/04/2020 00:00
3108,MARIE ANTOINETTE TRINKET BOX GOLD,MARIE ANTOINETTE TRINKET BOX GOLD,1.65,,0,1,RASTA-IN-BATH-W-SPLIFF-ASHTRAY,90201D,11/06/2020 00:00
3109,MARIE ANTOINETTE TRINKET BOX SILVER,MARIE ANTOINETTE TRINKET BOX SILVER,2.95,,0,1,FLOWER-GARLAND-NECKLACE-RED,90201C,01/12/2020 00:00
3110,JUMBO BAG VINTAGE LEAF,JUMBO BAG VINTAGE LEAF,2.95,,0,1,IVORY-SHELL-HEART-EARRINGS,90201A,14/06/2020 00:00
3111,PAPER LANTERN 9 POINT HOLLY STAR L,PAPER LANTERN 9 POINT HOLLY STAR L,2.95,,0,1,TURQ-STONE-CRYSTAL-EARRINGS,71495A,21/08/2020 00:00
3112,PAPER LANTERN 9 POINT DELUXE STAR,PAPER LANTERN 9 POINT DELUXE STAR,0.03,,0,1,FLOWER-GLASS-GARLAND-NECKL36BLUE,23162,15/06/2020 00:00
3113,PAPER LANTERN 5 POINT SEQUIN STAR,PAPER LANTERN 5 POINT SEQUIN STAR,2.1,,0,1,FOLDING-BUTTERFLY-MIRROR-IVORY-,20840,06/12/2020 00:00
3114,PAPER LANTERN 9 POINT HOLLY STAR S,PAPER LANTERN 9 POINT HOLLY STAR S,7.95,,0,1,FOLDING-BUTTERFLY-MIRROR-HOT-PINK-,72811,08/06/2020 00:00
3115,PAPER LANTERN 9 POINT HOLLY STAR 23,PAPER LANTERN 9 POINT HOLLY STAR 23,6.45,,0,1,BUNDLE-OF-3-SCHOOL-EXERCISE-BOOKS-,20816,09/04/2020 00:00
3116,PAPER LANTERN 5 POINT STUDDED STAR,PAPER LANTERN 5 POINT STUDDED STAR,1.65,,0,1,BUNDLE-OF-3-RETRO-NOTE-BOOKS,23048,03/02/2020 00:00
3117,"FOOD COVER WITH BEADS , SET 2 SIZES","FOOD COVER WITH BEADS , SET 2 SIZES",6.75,,0,1,GREEN-GOOSE-FEATHER-TREE-60CM,23042,12/07/2020 00:00
3118,RASTA IN BATH W SPLIFF ASHTRAY,RASTA IN BATH W SPLIFF ASHTRAY,1.65,,0,1,PINK-GOOSE-FEATHER-TREE-60CM,23064,08/02/2020 00:00
3119,FLOWER GARLAND NECKLACE RED,FLOWER GARLAND NECKLACE RED,1.25,,0,1,WHITE-GOOSE-FEATHER-TREE-60CM-,85225,05/10/2020 00:00
3120,IVORY SHELL HEART EARRINGS,IVORY SHELL HEART EARRINGS,7.95,,0,1,BUNDLE-OF-3-RETRO-EXERCISE-BOOKS,84629,12/09/2020 00:00
3121,TURQ STONE/CRYSTAL EARRINGS,TURQ STONE/CRYSTAL EARRINGS,14.95,,0,1,REGENCY-MILK-JUG-PINK-,20835,04/01/2020 00:00
3122,"FLOWER GLASS GARLAND NECKL.36""BLUE","FLOWER GLASS GARLAND NECKL.36""BLUE",3.75,,0,1,REGENCY-SUGAR-BOWL-GREEN,22987,30/05/2020 00:00
3123,FOLDING BUTTERFLY MIRROR IVORY ,FOLDING BUTTERFLY MIRROR IVORY ,7.95,,0,1,REGENCY-TEAPOT-ROSES-,20836,30/08/2020 00:00
3124,FOLDING BUTTERFLY MIRROR HOT PINK ,FOLDING BUTTERFLY MIRROR HOT PINK ,2.95,,0,1,REGENCY-TEA-PLATE-PINK,20838,28/09/2020 00:00
3125,BUNDLE OF 3 SCHOOL EXERCISE BOOKS  ,BUNDLE OF 3 SCHOOL EXERCISE BOOKS  ,1.65,,0,1,REGENCY-TEA-PLATE-GREEN-,23160,05/06/2020 00:00
3126,BUNDLE OF 3 RETRO NOTE BOOKS,BUNDLE OF 3 RETRO NOTE BOOKS,2.95,,0,1,REGENCY-TEA-PLATE-ROSES-,23161,28/03/2020 00:00
3127,GREEN GOOSE FEATHER TREE 60CM,GREEN GOOSE FEATHER TREE 60CM,2.55,,0,1,GREEN-METAL-BOX-ARMY-SUPPLIES,23164,06/11/2020 00:00
3128,PINK GOOSE FEATHER TREE 60CM,PINK GOOSE FEATHER TREE 60CM,0.85,,0,1,RABBIT-NIGHT-LIGHT,23149,27/05/2020 00:00
3129,WHITE GOOSE FEATHER TREE 60CM ,WHITE GOOSE FEATHER TREE 60CM ,5.95,,0,1,FOLDING-BUTTERFLY-MIRROR-RED-,84705C,20/08/2020 00:00
3130,BUNDLE OF 3 RETRO EXERCISE BOOKS,BUNDLE OF 3 RETRO EXERCISE BOOKS,7.95,,0,1,PARISIENNE-JEWELLERY-DRAWER-,23143,15/04/2020 00:00
3131,REGENCY MILK JUG PINK ,REGENCY MILK JUG PINK ,2.95,,0,1,PETIT-TRAY-CHIC,23070,20/07/2020 00:00
3132,REGENCY SUGAR BOWL GREEN,REGENCY SUGAR BOWL GREEN,2.95,,0,1,ZINC-HERB-GARDEN-CONTAINER,23151,28/01/2020 00:00
3133,REGENCY TEAPOT ROSES ,REGENCY TEAPOT ROSES ,4.95,,0,1,LE-GRAND-TRAY-CHIC-SET,90058A,15/08/2020 00:00
3134,REGENCY TEA PLATE PINK,REGENCY TEA PLATE PINK,2.1,,0,1,SET-OF-10-LED-DOLLY-LIGHTS,35599D,26/10/2020 00:00
3135,REGENCY TEA PLATE GREEN ,REGENCY TEA PLATE GREEN ,3.75,,0,1,RED-METAL-BOX-TOP-SECRET,20964,31/05/2020 00:00
3136,REGENCY TEA PLATE ROSES ,REGENCY TEA PLATE ROSES ,1.95,,0,1,GREEN-METAL-BOX-TOP-SECRET,84859B,27/08/2020 00:00
3137,GREEN METAL BOX ARMY SUPPLIES,GREEN METAL BOX ARMY SUPPLIES,9.95,,0,1,PARISIENNE-KEY-CABINET-,23200,25/10/2020 00:00
3138,RABBIT NIGHT LIGHT,RABBIT NIGHT LIGHT,1.25,,0,1,BUNDLE-OF-3-ALPHABET-EXERCISE-BOOKS,90076,30/05/2020 00:00
3139,FOLDING BUTTERFLY MIRROR RED  ,FOLDING BUTTERFLY MIRROR RED  ,7.95,,0,1,SILVER-BELLS-TABLE-DECORATION,23072,19/05/2020 00:00
3140,PARISIENNE JEWELLERY DRAWER ,PARISIENNE JEWELLERY DRAWER ,1.25,,0,1,SILVER-HEARTS-TABLE-DECORATION,23202,26/08/2020 00:00
3141,PETIT TRAY CHIC,PETIT TRAY CHIC,5.95,,0,1,VINTAGE-ENGRAVED-HEART,23046,20/11/2020 00:00
3142,ZINC HERB GARDEN CONTAINER,ZINC HERB GARDEN CONTAINER,1.25,,0,1,SET-6-PAPER-TABLE-LANTERN-HEARTS-,35443,06/10/2020 00:00
3143,LE GRAND TRAY CHIC SET,LE GRAND TRAY CHIC SET,1.25,,0,1,FLOWERS-HANDBAG-blue-and-orange,90036A,29/01/2020 00:00
3144,SET OF 10 LED DOLLY LIGHTS,SET OF 10 LED DOLLY LIGHTS,1.45,,0,1,SMALL-PARISIENNE-HEART-PHOTO-FRAME-,90033,02/08/2020 00:00
3145,RED METAL BOX TOP SECRET,RED METAL BOX TOP SECRET,0.65,,0,1,FOLDING-MIRROR-HOT-PINK-,90130B,19/01/2020 00:00
3146,GREEN METAL BOX TOP SECRET,GREEN METAL BOX TOP SECRET,5.95,,0,1,LED-TEA-LIGHTS,90036C,04/02/2020 00:00
3147,PARISIENNE KEY CABINET ,PARISIENNE KEY CABINET ,1.65,,0,1,BELL-HEART-DECORATION,23190,05/02/2020 00:00
3148,BUNDLE OF 3 ALPHABET EXERCISE BOOKS,BUNDLE OF 3 ALPHABET EXERCISE BOOKS,2.95,,0,1,ALUMINIUM-HEART,21263,09/04/2020 00:00
3149,SILVER BELLS TABLE DECORATION,SILVER BELLS TABLE DECORATION,3.75,,0,1,CRYSTAL-CHANDELIER-T-LIGHT-HOLDER,21265,11/07/2020 00:00
3150,SILVER HEARTS TABLE DECORATION,SILVER HEARTS TABLE DECORATION,3.75,,0,1,PARISIENNE-CURIO-CABINET,21264,23/08/2020 00:00
3151,VINTAGE ENGRAVED HEART,VINTAGE ENGRAVED HEART,1.45,,0,1,PARISIENNE-SEWING-BOX,23175,06/12/2020 00:00
3152,SET 6 PAPER TABLE LANTERN HEARTS ,SET 6 PAPER TABLE LANTERN HEARTS ,0.85,,0,1,TOADSTOOL-BEDSIDE-LIGHT-,23174,03/05/2020 00:00
3153,FLOWERS HANDBAG blue and orange,FLOWERS HANDBAG blue and orange,1.65,,0,1,SMALL-CERAMIC-TOP-STORAGE-JAR-,23173,09/04/2020 00:00
3154,SMALL PARISIENNE HEART PHOTO FRAME ,SMALL PARISIENNE HEART PHOTO FRAME ,0.65,,0,1,IVORY-PANTRY-HANGING-LAMP-,23172,21/10/2020 00:00
3155,FOLDING MIRROR HOT PINK ,FOLDING MIRROR HOT PINK ,2.1,,0,1,CLASSIC-SUGAR-DISPENSER,23171,27/01/2020 00:00
3156,LED TEA LIGHTS,LED TEA LIGHTS,0.42,,0,1,LARGE-ZINC-GLASS-CANDLEHOLDER,23170,15/04/2020 00:00
3157,BELL HEART DECORATION,BELL HEART DECORATION,0.42,,0,1,MISELTOE-HEART-WREATH-WHITE,23084,01/04/2020 00:00
3158,ALUMINIUM HEART,ALUMINIUM HEART,0.65,,0,1,MISELTOE-HEART-WREATH-,23118,01/03/2020 00:00
3159,CRYSTAL CHANDELIER T-LIGHT HOLDER,CRYSTAL CHANDELIER T-LIGHT HOLDER,0.42,,0,1,CLASSIC-GLASS-SWEET-JAR,23096,09/09/2020 00:00
3160,PARISIENNE CURIO CABINET,PARISIENNE CURIO CABINET,1.45,,0,1,LARGE-CERAMIC-TOP-STORAGE-JAR,23094,18/09/2020 00:00
3161,PARISIENNE SEWING BOX,PARISIENNE SEWING BOX,2.95,,0,1,LARGE-JEWELLERY-STAND,23108,13/05/2020 00:00
3162,TOADSTOOL BEDSIDE LIGHT ,TOADSTOOL BEDSIDE LIGHT ,2.95,,0,1,SMALL-JEWELLERY-STAND,23080,23/07/2020 00:00
3163,SMALL CERAMIC TOP STORAGE JAR ,SMALL CERAMIC TOP STORAGE JAR ,0.65,,0,1,SILVER-STARS-TABLE-DECORATION,23110,29/01/2020 00:00
3164,IVORY PANTRY HANGING LAMP ,IVORY PANTRY HANGING LAMP ,4.25,,0,1,GLASS-BON-BON-JAR,23192,19/08/2020 00:00
3165,CLASSIC SUGAR DISPENSER,CLASSIC SUGAR DISPENSER,0.85,,0,1,WHITE-WIRE-PLANT-POT-HOLDER,23100,31/03/2020 00:00
3166,LARGE ZINC GLASS CANDLEHOLDER,LARGE ZINC GLASS CANDLEHOLDER,1.95,,0,1,CLASSIC-GLASS-COOKIE-JAR,23102,21/02/2020 00:00
3167,MISELTOE HEART WREATH WHITE,MISELTOE HEART WREATH WHITE,1.25,,0,1,FIRE-POLISHED-GLASS-BRACELET-GREEN,23082,30/12/2020 00:00
3168,MISELTOE HEART WREATH ,MISELTOE HEART WREATH ,0.42,,0,1,FIRE-POLISHED-GLASS-BRACELET-MONTAN,16151A,06/04/2020 00:00
3169,CLASSIC GLASS SWEET JAR,CLASSIC GLASS SWEET JAR,0.65,,0,1,FIRE-POLISHED-GLASS-BRACELET-RED,23093,01/10/2020 00:00
3170,LARGE CERAMIC TOP STORAGE JAR,LARGE CERAMIC TOP STORAGE JAR,0.85,,0,1,CLASSIC-CAFE-SUGAR-DISPENSER,23112,05/02/2020 00:00
3171,LARGE JEWELLERY STAND,LARGE JEWELLERY STAND,0.42,,0,1,JINGLE-BELL-HEART-DECORATION,23111,30/07/2020 00:00
3172,SMALL JEWELLERY STAND,SMALL JEWELLERY STAND,9.95,,0,1,ZINC-HEARTS-PLANT-POT-HOLDER,23167,18/05/2020 00:00
3173,SILVER STARS TABLE DECORATION,SILVER STARS TABLE DECORATION,0.85,,0,1,WHITE-HEARTS-WIRE-PLANT-POT-HOLDER,72812,26/09/2020 00:00
3174,GLASS BON BON JAR,GLASS BON BON JAR,1.65,,0,1,ZINC-HEART-T-LIGHT-HOLDER,23165,28/01/2020 00:00
3175,WHITE WIRE PLANT POT HOLDER,WHITE WIRE PLANT POT HOLDER,0.85,,0,1,ZINC-HEART-FLOWER-T-LIGHT-HOLDER,23101,31/08/2020 00:00
3176,CLASSIC GLASS COOKIE JAR,CLASSIC GLASS COOKIE JAR,1.45,,0,1,METAL-HERB-GERDEN-CONTAINER,23089,03/10/2020 00:00
3177,FIRE POLISHED GLASS BRACELET GREEN,FIRE POLISHED GLASS BRACELET GREEN,0.55,,0,1,ZINC-PLANT-POT-HOLDER,90039D,12/09/2020 00:00
3178,FIRE POLISHED GLASS BRACELET MONTAN,FIRE POLISHED GLASS BRACELET MONTAN,2.95,,0,1,FOLDING-MIRROR-IVORY-,90039B,20/04/2020 00:00
3179,FIRE POLISHED GLASS BRACELET RED,FIRE POLISHED GLASS BRACELET RED,1.65,,0,1,FOLDING-MIRROR-RED-,90039A,20/08/2020 00:00
3180,CLASSIC CAFE SUGAR DISPENSER,CLASSIC CAFE SUGAR DISPENSER,2.95,,0,1,PEARL-SHELL-42NECKL-IVORY,23087,12/01/2020 00:00
3181,JINGLE BELL HEART DECORATION,JINGLE BELL HEART DECORATION,2.95,,0,1,GARDENERS-KNEELING-PAD-KEEP-CALM-,23088,26/08/2020 00:00
3182,ZINC HEARTS PLANT POT HOLDER,ZINC HEARTS PLANT POT HOLDER,1.95,,0,1,GARDENERS-KNEELING-PAD-CUP-OF-TEA-,90035C,14/08/2020 00:00
3183,WHITE HEARTS WIRE PLANT POT HOLDER,WHITE HEARTS WIRE PLANT POT HOLDER,0.85,,0,1,KNEELING-MAT-HOUSEWORK-DESIGN,23301,18/07/2020 00:00
3184,ZINC  HEART T-LIGHT HOLDER,ZINC  HEART T-LIGHT HOLDER,2.95,,0,1,ENGLISH-ROSE-SCENTED-HANGING-HEART,23300,14/07/2020 00:00
3185,ZINC HEART FLOWER T-LIGHT HOLDER,ZINC HEART FLOWER T-LIGHT HOLDER,0.55,,0,1,VINTAGE-GLASS-T-LIGHT-HOLDER,23302,26/05/2020 00:00
3186,METAL HERB GERDEN CONTAINER,METAL HERB GERDEN CONTAINER,2.55,,0,1,SET-6-PAPER-TABLE-LANTERN-STARS-,47574B,02/12/2020 00:00
3187,ZINC PLANT POT HOLDER,ZINC PLANT POT HOLDER,0.85,,0,1,LARGE-ANTIQUE-WHITE-PHOTO-FRAME,23090,23/04/2020 00:00
3188,FOLDING MIRROR IVORY ,FOLDING MIRROR IVORY ,1.65,,0,1,ANTIQUE-SILVER-BAUBLE-LAMP-,23083,10/07/2020 00:00
3189,FOLDING MIRROR RED  ,FOLDING MIRROR RED  ,1.65,,0,1,FRENCH-CARRIAGE-LANTERN,23092,13/05/2020 00:00
3190,"PEARL & SHELL 42""NECKL. IVORY","PEARL & SHELL 42""NECKL. IVORY",2.1,,0,1,ZINC-STAR-T-LIGHT-HOLDER-,23085,04/05/2020 00:00
3191,GARDENERS KNEELING PAD KEEP CALM ,GARDENERS KNEELING PAD KEEP CALM ,1.65,,0,1,WHITE-SQUARE-TABLE-CLOCK,23099,06/02/2020 00:00
3192,GARDENERS KNEELING PAD CUP OF TEA ,GARDENERS KNEELING PAD CUP OF TEA ,1.25,,0,1,LETTER-Y-BLING-KEY-RING,84661A,04/03/2020 00:00
3193,KNEELING MAT HOUSEWORK  DESIGN,KNEELING MAT HOUSEWORK  DESIGN,1.25,,0,1,FUNKY-FLOWER-PICNIC-BAG-FOR-4,90214Y,26/10/2020 00:00
