id,title,Description,price,image,featured,active,slug,stockcode,timestamp
1934,BLACK PHOTO ALBUM ,BLACK PHOTO ALBUM ,2.95,,0,1,EASTER-DECORATION-NATURAL-CHICK,21647,12/01/2020 00:00
1935,EASTER DECORATION NATURAL CHICK,EASTER DECORATION NATURAL CHICK,3.75,,0,1,ASSORTED-COLOUR-SUCTION-CUP-HOOK,72122,03/05/2020 00:00
1936,ASSORTED COLOUR SUCTION CUP HOOK,ASSORTED COLOUR SUCTION CUP HOOK,2.95,,0,1,GINGHAM-BABUSHKA-DOORSTOP,84912A,30/12/2020 00:00
1937,GINGHAM BABUSHKA DOORSTOP,GINGHAM BABUSHKA DOORSTOP,0.95,,0,1,DOORMAT-MULTICOLOUR-STRIPE,85036A,03/02/2020 00:00
1938,DOORMAT MULTICOLOUR STRIPE,DOORMAT MULTICOLOUR STRIPE,2.95,,0,1,IVORY-SCULPTED-RND-CANDLE-,21692,03/01/2020 00:00
1939,IVORY SCULPTED RND CANDLE ,IVORY SCULPTED RND CANDLE ,1.25,,0,1,COLUMBIAN-CUBE-CANDLE,21618,22/11/2020 00:00
1940,COLUMBIAN CUBE CANDLE,COLUMBIAN CUBE CANDLE,3.39,,0,1,HEART-T-LIGHT-HOLDER,84569A,23/07/2020 00:00
1941,HEART T-LIGHT HOLDER,HEART T-LIGHT HOLDER,2.55,,0,1,FOLK-ART-METAL-HEART-T-LIGHT-HOLDER,20775,12/08/2020 00:00
1942,FOLK ART METAL HEART T-LIGHT HOLDER,FOLK ART METAL HEART T-LIGHT HOLDER,5.95,,0,1,CERAMIC-BOWL-WITH-STRAWBERRY-DESIGN,90179C,07/09/2020 00:00
1943,CERAMIC BOWL WITH STRAWBERRY DESIGN,CERAMIC BOWL WITH STRAWBERRY DESIGN,5.95,,0,1,AMETHYST-CHUNKY-BEAD-BRACELET-W-STR,90060D,26/07/2020 00:00
1944,AMETHYST CHUNKY BEAD BRACELET W STR,AMETHYST CHUNKY BEAD BRACELET W STR,1.65,,0,1,AMBER-CHUNKY-BEAD-BRACELET-W-STRAP,85020,16/04/2020 00:00
1945,AMBER CHUNKY BEAD BRACELET W STRAP,AMBER CHUNKY BEAD BRACELET W STRAP,2.1,,0,1,BLUE-FLOCK-CUSHION-COVER-,20861,18/11/2020 00:00
1946,BLUE FLOCK CUSHION COVER ,BLUE FLOCK CUSHION COVER ,5.95,,0,1,VINTAGE-NOTEBOOK-BEAUTY-GIRL,21827,12/07/2020 00:00
1947,VINTAGE NOTEBOOK BEAUTY GIRL,VINTAGE NOTEBOOK BEAUTY GIRL,2.25,,0,1,BLUE-PADDED-SOFT-MOBILE,85169A,27/03/2020 00:00
1948,BLUE PADDED SOFT MOBILE,BLUE PADDED SOFT MOBILE,1.25,,0,1,PAIR-BUTTERFLY-HAIR-CLIPS,17007B,18/06/2020 00:00
1949,PAIR BUTTERFLY HAIR CLIPS,PAIR BUTTERFLY HAIR CLIPS,3.75,,0,1,DOORSTOP-FOOTBALL-DESIGN,22339,09/12/2020 00:00
1950,DOORSTOP FOOTBALL DESIGN,DOORSTOP FOOTBALL DESIGN,0.55,,0,1,A4-WALL-TIDY-BLUE-OFFICE,22700,18/04/2020 00:00
1951,A4 WALL TIDY BLUE OFFICE,A4 WALL TIDY BLUE OFFICE,0.85,,0,1,CD-WALL-TIDY-RED-FLOWERS,10124A,26/05/2020 00:00
1952,CD WALL TIDY RED FLOWERS,CD WALL TIDY RED FLOWERS,0.42,,0,1,MAGAZINE-RACK-GEBRA-ASSORTED-,21644,05/09/2020 00:00
1953,MAGAZINE RACK GEBRA ASSORTED ,MAGAZINE RACK GEBRA ASSORTED ,1.65,,0,1,TEA-TIME-TEAPOT-IN-GIFT-BOX,46000P,05/03/2020 00:00
1954,TEA TIME TEAPOT IN GIFT BOX,TEA TIME TEAPOT IN GIFT BOX,4.25,,0,1,WALL-MIRROR-RECTANGLE-DIAMANTE-PINK,21638,21/11/2020 00:00
1955,WALL MIRROR RECTANGLE DIAMANTE PINK,WALL MIRROR RECTANGLE DIAMANTE PINK,4.25,,0,1,CHRISTMAS-CRAFT-HEART-STOCKING-,22681,09/08/2020 00:00
1956,CHRISTMAS CRAFT HEART STOCKING ,CHRISTMAS CRAFT HEART STOCKING ,2.95,,0,1,HEART-STRING-MEMO-HOLDER-HANGING,21746,10/08/2020 00:00
1957,HEART STRING MEMO HOLDER HANGING,HEART STRING MEMO HOLDER HANGING,2.95,,0,1,BLUE-PAISLEY-SKETCHBOOK,84916,02/03/2020 00:00
1958,BLUE PAISLEY SKETCHBOOK,BLUE PAISLEY SKETCHBOOK,2.55,,0,1,BAKING-SET-9-PIECE-RETROSPOT-,40005B,04/08/2020 00:00
1959,BAKING SET 9 PIECE RETROSPOT ,BAKING SET 9 PIECE RETROSPOT ,1.25,,0,1,ORANGE-VOTIVE-CANDLE,18094C,22/07/2020 00:00
1960,ORANGE VOTIVE CANDLE,ORANGE VOTIVE CANDLE,3.25,,0,1,4-PINK-FLOCK-CHRISTMAS-BALLS,22085,24/04/2020 00:00
1961,4 PINK FLOCK CHRISTMAS BALLS,4 PINK FLOCK CHRISTMAS BALLS,4.25,,0,1,METAL-BASE-FOR-CANDLES,47586A,10/12/2020 00:00
1962,METAL BASE FOR CANDLES,METAL BASE FOR CANDLES,1.65,,0,1,BOX-OF-9-PEBBLE-CANDLES,46115B,27/10/2020 00:00
1963,BOX OF 9 PEBBLE CANDLES,BOX OF 9 PEBBLE CANDLES,0.85,,0,1,FLORAL-BLUE-MONSTER,84975,30/07/2020 00:00
1964,FLORAL BLUE MONSTER,FLORAL BLUE MONSTER,4.95,,0,1,SET-3-TALL-GLASS-CANDLE-HOLDER-PINK,21336,17/04/2020 00:00
1965,SET/3 TALL GLASS CANDLE HOLDER PINK,SET/3 TALL GLASS CANDLE HOLDER PINK,9.95,,0,1,BLUE-POLKADOT-KIDS-BAG,15044C,06/08/2020 00:00
1966,BLUE POLKADOT KIDS BAG,BLUE POLKADOT KIDS BAG,2.95,,0,1,GIFT-BAG-BIRTHDAY,22673,13/01/2020 00:00
1967,GIFT BAG BIRTHDAY,GIFT BAG BIRTHDAY,4.25,,0,1,FUNKY-MONKEY-GIFT-BAG-MEDIUM,21262,10/07/2020 00:00
1968,FUNKY MONKEY GIFT BAG MEDIUM,FUNKY MONKEY GIFT BAG MEDIUM,0.85,,0,1,CLEAR-LOVE-BIRD-T-LIGHT-HOLDER,22050,19/06/2020 00:00
1969,CLEAR LOVE BIRD T-LIGHT HOLDER,CLEAR LOVE BIRD T-LIGHT HOLDER,1.65,,0,1,PINK-DIAMANTE-PEN-IN-GIFT-BOX,21680,13/02/2020 00:00
1970,PINK DIAMANTE PEN IN GIFT BOX,PINK DIAMANTE PEN IN GIFT BOX,0.85,,0,1,CHERRY-BLOSSOM-TABLE-CLOCK-,20819,05/08/2020 00:00
1971,CHERRY BLOSSOM TABLE CLOCK ,CHERRY BLOSSOM TABLE CLOCK ,1.65,,0,1,REGENCY-MIRROR-WITH-SHUTTERS,84925F,24/03/2020 00:00
1972,REGENCY MIRROR WITH SHUTTERS,REGENCY MIRROR WITH SHUTTERS,1.25,,0,1,VINTAGE-RED-MUG,21812,29/04/2020 00:00
1973,VINTAGE RED MUG,VINTAGE RED MUG,0.19,,0,1,VINTAGE-KITCHEN-PRINT-SEAFOOD,22535,26/06/2020 00:00
1974,VINTAGE KITCHEN PRINT SEAFOOD,VINTAGE KITCHEN PRINT SEAFOOD,2.95,,0,1,PINK-CAT-BOWL,21547,04/08/2020 00:00
1975,PINK CAT BOWL,PINK CAT BOWL,0.85,,0,1,SMALL-MEDINA-STAMPED-METAL-BOWL-,16169K,28/10/2020 00:00
1976,SMALL MEDINA STAMPED METAL BOWL ,SMALL MEDINA STAMPED METAL BOWL ,1.25,,0,1,FAWN-AND-MUSHROOM-GREETING-CARD,84707A,10/11/2020 00:00
1977,FAWN AND MUSHROOM GREETING CARD,FAWN AND MUSHROOM GREETING CARD,0.85,,0,1,BAKING-MOULD-CHOCOLATE-CUP-CAKES,21617,01/01/2021 00:00
1978,BAKING MOULD CHOCOLATE CUP CAKES,BAKING MOULD CHOCOLATE CUP CAKES,1.25,,0,1,SET-6-EAU-DE-NIL-BIRD-T-LIGHTS,21001,03/01/2020 00:00
1979,SET/6 EAU DE NIL BIRD T-LIGHTS,SET/6 EAU DE NIL BIRD T-LIGHTS,0.85,,0,1,CHILDS-GARDEN-RAKE-BLUE,21000,11/08/2020 00:00
1980,CHILDS GARDEN RAKE BLUE,CHILDS GARDEN RAKE BLUE,1.25,,0,1,CHILDS-GARDEN-FORK-PINK,22693,24/06/2020 00:00
1981,CHILDS GARDEN FORK PINK,CHILDS GARDEN FORK PINK,4.25,,0,1,CHILDS-GARDEN-TROWEL-PINK,20782,01/05/2020 00:00
1982,CHILDS GARDEN TROWEL PINK,CHILDS GARDEN TROWEL PINK,8.5,,0,1,PINK-REGENCY-TEACUP-AND-SAUCER,21397,26/04/2020 00:00
1983,PINK REGENCY TEACUP AND SAUCER,PINK REGENCY TEACUP AND SAUCER,3.75,,0,1,FRENCH-ENAMEL-CANDLEHOLDER,35646,02/07/2020 00:00
1984,FRENCH ENAMEL CANDLEHOLDER,FRENCH ENAMEL CANDLEHOLDER,3.75,,0,1,GREEN-SQUARE-COMPACT-MIRROR,47574A,20/07/2020 00:00
1985,GREEN SQUARE COMPACT MIRROR,GREEN SQUARE COMPACT MIRROR,0.85,,0,1,BLUE-HEART-COMPACT-MIRROR,72819,10/11/2020 00:00
1986,BLUE HEART COMPACT MIRROR,BLUE HEART COMPACT MIRROR,6.35,,0,1,JET-BLACK-LAS-VEGAS-NECKLACE-45CM,84665,19/05/2020 00:00
1987,JET BLACK LAS VEGAS NECKLACE 45CM,JET BLACK LAS VEGAS NECKLACE 45CM,8.95,,0,1,ASSORTED-COLOUR-METAL-CAT-,20857,08/11/2020 00:00
1988,ASSORTED COLOUR METAL CAT ,ASSORTED COLOUR METAL CAT ,2.55,,0,1,TRIANGULAR-POUFFE-VINTAGE-,22908,17/06/2020 00:00
1989,TRIANGULAR POUFFE VINTAGE ,TRIANGULAR POUFFE VINTAGE ,3.39,,0,1,FELT-TOADSTOOL-LARGE,21627,18/09/2020 00:00
1990,FELT TOADSTOOL LARGE,FELT TOADSTOOL LARGE,4.95,,0,1,4-LAVENDER-BOTANICAL-DINNER-CANDLES,85047,08/04/2020 00:00
1991,4 LAVENDER BOTANICAL DINNER CANDLES,4 LAVENDER BOTANICAL DINNER CANDLES,6.95,,0,1,CAKE-STAND-3-TIER-MAGIC-GARDEN,22498,05/07/2020 00:00
1992,CAKE STAND 3 TIER MAGIC GARDEN,CAKE STAND 3 TIER MAGIC GARDEN,2.1,,0,1,BAKING-MOULD-EASTER-EGG-MILK-CHOC,84725,25/03/2020 00:00
1993,BAKING MOULD EASTER EGG MILK CHOC,BAKING MOULD EASTER EGG MILK CHOC,2.55,,0,1,CUT-GLASS-T-LIGHT-HOLDER-OCTAGON,37479P,15/11/2020 00:00
1994,CUT GLASS T-LIGHT HOLDER OCTAGON,CUT GLASS T-LIGHT HOLDER OCTAGON,1.65,,0,1,FUNKY-DIVA-PEN,21534,16/11/2020 00:00
1995,FUNKY DIVA PEN,FUNKY DIVA PEN,3.39,,0,1,RIBBONS-PURSE-,22515,17/04/2020 00:00
1996,RIBBONS PURSE ,RIBBONS PURSE ,3.39,,0,1,SET-4-SPRING-FLOWER-DECORATION,22518,29/01/2020 00:00
1997,SET/4 SPRING FLOWER DECORATION,SET/4 SPRING FLOWER DECORATION,7.65,,0,1,ASSORTED-CIRCULAR-MOBILE,22101,12/05/2020 00:00
1998,ASSORTED CIRCULAR MOBILE,ASSORTED CIRCULAR MOBILE,35.75,,0,1,ASS-COL-CIRCLE-MOBILE-,22545,15/12/2020 00:00
1999,ASS COL CIRCLE MOBILE ,ASS COL CIRCLE MOBILE ,4.25,,0,1,METAL-TUBE-CHIME-ON-BAMBOO,17038,02/12/2020 00:00
2000,METAL TUBE CHIME ON BAMBOO,METAL TUBE CHIME ON BAMBOO,1.85,,0,1,WHITE-BAMBOO-RIBS-LAMPSHADE,21012,19/08/2020 00:00
2001,WHITE BAMBOO RIBS LAMPSHADE,WHITE BAMBOO RIBS LAMPSHADE,1.85,,0,1,RETRO-PLASTIC-POLKA-TRAY,84912B,08/08/2020 00:00
2002,RETRO PLASTIC POLKA TRAY,RETRO PLASTIC POLKA TRAY,1.06,,0,1,FLOWER-GLASS-GARLAND-NECKL36BLACK,84388,06/01/2020 00:00
2003,"FLOWER GLASS GARLAND NECKL.36""BLACK","FLOWER GLASS GARLAND NECKL.36""BLACK",1.06,,0,1,RED-RETROSPOT-SMALL-MILK-JUG,17084J,30/10/2020 00:00
2004,RED RETROSPOT SMALL MILK JUG,RED RETROSPOT SMALL MILK JUG,1.06,,0,1,MEDIUM-CHINESE-STYLE-SCISSOR,84968D,29/03/2020 00:00
2005,MEDIUM CHINESE STYLE SCISSOR,MEDIUM CHINESE STYLE SCISSOR,1.06,,0,1,SMALL-FOLDING-SCISSORPOINTED-EDGE,22613,28/12/2020 00:00
2006,SMALL FOLDING SCISSOR(POINTED EDGE),SMALL FOLDING SCISSOR(POINTED EDGE),4.95,,0,1,RETROSPOT-CANDLE-SMALL,22211,12/05/2020 00:00
2007,RETROSPOT CANDLE  SMALL,RETROSPOT CANDLE  SMALL,1.65,,0,1,BLUE-BREAKFAST-CUP-AND-SAUCER-,22903,01/10/2020 00:00
2008,BLUE BREAKFAST CUP AND SAUCER ,BLUE BREAKFAST CUP AND SAUCER ,3.39,,0,1,RETRO-TEA-FOR-ONE-,22026,09/04/2020 00:00
2009,"RETRO ""TEA FOR ONE"" ","RETRO ""TEA FOR ONE"" ",3.39,,0,1,GARDEN-PATH-NOTEBOOK-,20839,26/11/2020 00:00
2010,GARDEN PATH NOTEBOOK ,GARDEN PATH NOTEBOOK ,4.25,,0,1,ABSTRACT-CIRCLES-POCKET-BOOK,37340,08/06/2020 00:00
2011,ABSTRACT CIRCLES POCKET BOOK,ABSTRACT CIRCLES POCKET BOOK,7.65,,0,1,S-4-IVORY-MINI-ROSE-CANDLE-IN-BOWL,21171,08/09/2020 00:00
2012,S/4 IVORY MINI ROSE CANDLE IN BOWL,S/4 IVORY MINI ROSE CANDLE IN BOWL,2.55,,0,1,SET-4-BLUE-FLOWER-CANDLES-IN-BOWL,85232D,21/06/2020 00:00
2013,SET/4 BLUE FLOWER CANDLES IN BOWL,SET/4 BLUE FLOWER CANDLES IN BOWL,3.39,,0,1,HAIRCLIPS-FORTIES-FABRIC-ASSORTED,21773,02/09/2020 00:00
2014,HAIRCLIPS FORTIES FABRIC ASSORTED,HAIRCLIPS FORTIES FABRIC ASSORTED,1.85,,0,1,3-TIER-SWEETHEART-GARDEN-SHELF,21689,02/05/2020 00:00
2015,3 TIER SWEETHEART GARDEN SHELF,3 TIER SWEETHEART GARDEN SHELF,1.85,,0,1,FAIRY-DREAMS-INCENSE-,20762,20/09/2020 00:00
2016,FAIRY DREAMS INCENSE ,FAIRY DREAMS INCENSE ,0.85,,0,1,DRAGONS-BLOOD-INCENSE,85170B,19/07/2020 00:00
2017,DRAGONS BLOOD INCENSE,DRAGONS BLOOD INCENSE,0.85,,0,1,GOLD-FISHING-GNOME,84596J,20/07/2020 00:00
2018,GOLD FISHING GNOME,GOLD FISHING GNOME,3.95,,0,1,SILVER-STANDING-GNOME-,85170A,31/10/2020 00:00
2019,SILVER STANDING GNOME   ,SILVER STANDING GNOME   ,2.95,,0,1,DANISH-ROSE-PHOTO-FRAME,85059,09/06/2020 00:00
2020,DANISH ROSE PHOTO FRAME,DANISH ROSE PHOTO FRAME,2.95,,0,1,HEARTS-GIFT-TAPE,84497,19/11/2020 00:00
2021,HEARTS GIFT TAPE,HEARTS GIFT TAPE,0.85,,0,1,PINK-FOXGLOVE-ARTIIFCIAL-FLOWER,85026B,19/12/2020 00:00
2022,PINK FOXGLOVE ARTIIFCIAL FLOWER,PINK FOXGLOVE ARTIIFCIAL FLOWER,0.85,,0,1,JIGSAW-TREE-WITH-WATERING-CAN,90175D,20/03/2020 00:00
2023,JIGSAW TREE WITH WATERING CAN,JIGSAW TREE WITH WATERING CAN,1.45,,0,1,SET-OF-3-CONEY-ISLAND-OVAL-BOXES,22495,31/08/2020 00:00
2024,SET OF 3 CONEY ISLAND OVAL BOXES,SET OF 3 CONEY ISLAND OVAL BOXES,1.45,,0,1,MINT-GREEN-ROSE-TOWEL,85176,07/01/2020 00:00
2025,MINT GREEN ROSE TOWEL,MINT GREEN ROSE TOWEL,6.75,,0,1,SOFT-PINK-ROSE-TOWEL-,90212B,25/12/2020 00:00
2026,SOFT PINK ROSE TOWEL ,SOFT PINK ROSE TOWEL ,0.85,,0,1,HAND-TOWEL-PINK-FLOWER-AND-DAISY,90212C,12/01/2020 00:00
2027,HAND TOWEL PINK FLOWER AND DAISY,HAND TOWEL PINK FLOWER AND DAISY,1.25,,0,1,WHITE-SOAP-RACK-WITH-2-BOTTLES,22708,21/04/2020 00:00
2028,WHITE SOAP RACK WITH 2 BOTTLES,WHITE SOAP RACK WITH 2 BOTTLES,3.75,,0,1,ROMANTIC-IMAGES-GIFT-WRAP-SET,22048,16/11/2020 00:00
2029,ROMANTIC IMAGES GIFT WRAP SET,ROMANTIC IMAGES GIFT WRAP SET,3.75,,0,1,CURIOUS-IMAGES-GIFT-WRAP-SET,22057,22/09/2020 00:00
2030,CURIOUS IMAGES GIFT WRAP SET,CURIOUS IMAGES GIFT WRAP SET,2.1,,0,1,VINTAGE-BEAD-PINK-PURSE-,37447,10/03/2020 00:00
2031,VINTAGE BEAD PINK PURSE ,VINTAGE BEAD PINK PURSE ,5.95,,0,1,TEA-TIME-TEA-SET-IN-GIFT-BOX,22930,29/07/2020 00:00
2032,TEA TIME TEA SET IN GIFT BOX,TEA TIME TEA SET IN GIFT BOX,5.95,,0,1,POMPOM-CURTAIN,22931,09/10/2020 00:00
2033,POMPOM CURTAIN,POMPOM CURTAIN,4.95,,0,1,SET-OF-6-RIBBONS-VINTAGE-CHRISTMAS,22710,19/07/2020 00:00
2034,SET OF 6 RIBBONS VINTAGE CHRISTMAS,SET OF 6 RIBBONS VINTAGE CHRISTMAS,2.95,,0,1,ENGLISH-ROSE-SMALL-SCENTED-FLOWER,22051,23/04/2020 00:00
2035,ENGLISH ROSE SMALL SCENTED FLOWER,ENGLISH ROSE SMALL SCENTED FLOWER,2.95,,0,1,FRENCH-BLUE-METAL-DOOR-SIGN-4,22936,07/09/2020 00:00
2036,FRENCH BLUE METAL DOOR SIGN 4,FRENCH BLUE METAL DOOR SIGN 4,2.95,,0,1,SET-OF-36-DOILIES-SPACEBOY-DESIGN-,22935,17/10/2020 00:00
2037,SET OF 36 DOILIES SPACEBOY DESIGN ,SET OF 36 DOILIES SPACEBOY DESIGN ,2.95,,0,1,HAWAIIAN-GRASS-SKIRT-,22789,08/10/2020 00:00
2038,HAWAIIAN GRASS SKIRT ,HAWAIIAN GRASS SKIRT ,1.25,,0,1,HEN-HOUSE-W-CHICK-STANDING,21275,27/02/2020 00:00
2039,HEN HOUSE W CHICK STANDING,HEN HOUSE W CHICK STANDING,1.45,,0,1,ASSORTED-EASTER-DECORATIONS-BELLS,85068,19/02/2020 00:00
2040,ASSORTED EASTER DECORATIONS  BELLS,ASSORTED EASTER DECORATIONS  BELLS,2.95,,0,1,BAKING-MOULD-EASTER-EGG-WHITE-CHOC,20716,17/07/2020 00:00
2041,BAKING MOULD EASTER EGG WHITE CHOC,BAKING MOULD EASTER EGG WHITE CHOC,9.95,,0,1,SET-4-COLOURFUL-MIXING-BOWLS,22167,17/11/2020 00:00
2042,SET/4 COLOURFUL MIXING BOWLS,SET/4 COLOURFUL MIXING BOWLS,0.85,,0,1,SET-OF-4-PISTACHIO-LOVEBIRD-COASTER,47348A,06/04/2020 00:00
2043,SET OF 4 PISTACHIO LOVEBIRD COASTER,SET OF 4 PISTACHIO LOVEBIRD COASTER,5.95,,0,1,SET-OF-4-BLACK-LOVEBIRD-COASTERS,90214C,05/10/2020 00:00
2044,SET OF 4 BLACK LOVEBIRD COASTERS,SET OF 4 BLACK LOVEBIRD COASTERS,5.95,,0,1,TEA-COSY-BLUE-STRIPE,90214B,22/08/2020 00:00
2045,TEA COSY BLUE STRIPE,TEA COSY BLUE STRIPE,2.95,,0,1,EMPIRE-DESIGN-ROSETTE,90214K,23/03/2020 00:00
2046,EMPIRE DESIGN ROSETTE,EMPIRE DESIGN ROSETTE,3.95,,0,1,DOORMAT-WELCOME-TO-OUR-HOME,20735,07/02/2020 00:00
2047,DOORMAT WELCOME TO OUR HOME,DOORMAT WELCOME TO OUR HOME,1.95,,0,1,GOLD-STANDING-GNOME,85039C,20/10/2020 00:00
2048,GOLD STANDING GNOME,GOLD STANDING GNOME,1.95,,0,1,FIRST-CLASS-LUGGAGE-TAG-,22448,14/03/2020 00:00
2049,FIRST CLASS LUGGAGE TAG ,FIRST CLASS LUGGAGE TAG ,7.95,,0,1,ASS-COL-LARGE-SAND-FROG-PWEIGHT,20996,11/01/2020 00:00
2050,ASS COL LARGE SAND FROG P'WEIGHT,ASS COL LARGE SAND FROG P'WEIGHT,7.95,,0,1,GREEN-BIRDHOUSE-DECORATION,21686,09/05/2020 00:00
2051,GREEN BIRDHOUSE DECORATION,GREEN BIRDHOUSE DECORATION,2.95,,0,1,HANGING-CHICK-CREAM-DECORATION,85024C,19/03/2020 00:00
2052,HANGING CHICK CREAM DECORATION,HANGING CHICK CREAM DECORATION,1.69,,0,1,BLUE-POLKADOT-GARDEN-PARASOL,71038,24/01/2020 00:00
2053,BLUE POLKADOT GARDEN PARASOL,BLUE POLKADOT GARDEN PARASOL,12.75,,0,1,SILVER-FABRIC-MIRROR,84613C,27/08/2020 00:00
2054,SILVER FABRIC MIRROR,SILVER FABRIC MIRROR,8.5,,0,1,WHITE-HONEYCOMB-PAPER-GARLAND-,84910A,19/12/2020 00:00
2055,WHITE HONEYCOMB PAPER GARLAND ,WHITE HONEYCOMB PAPER GARLAND ,4.95,,0,1,DANISH-ROSE-TRINKET-TRAYS,20763,11/05/2020 00:00
2056,DANISH ROSE TRINKET TRAYS,DANISH ROSE TRINKET TRAYS,2.95,,0,1,SET-4-NURSERY-DES-ROUND-BOXES,21201,26/07/2020 00:00
2057,SET 4 NURSERY DES ROUND BOXES,SET 4 NURSERY DES ROUND BOXES,2.95,,0,1,DANISH-ROSE-DELUXE-COASTER,21246,09/10/2020 00:00
2058,DANISH ROSE DELUXE COASTER,DANISH ROSE DELUXE COASTER,2.95,,0,1,SMALL-KITCHEN-FLOWER-POTS-PLAQUE,21376,02/05/2020 00:00
2059,SMALL KITCHEN FLOWER POTS PLAQUE,SMALL KITCHEN FLOWER POTS PLAQUE,2.95,,0,1,KITCHEN-FLOWER-POTS-WALL-PLAQUE,21375,21/12/2020 00:00
2060,KITCHEN FLOWER POTS WALL PLAQUE,KITCHEN FLOWER POTS WALL PLAQUE,0.85,,0,1,BUNNY-WOODEN-PAINTED-WITH-FLOWER-,21205,25/10/2020 00:00
2061,BUNNY WOODEN PAINTED WITH FLOWER ,BUNNY WOODEN PAINTED WITH FLOWER ,0.85,,0,1,KITTY-PENCIL-ERASERS,20618,01/01/2020 00:00
2062,KITTY PENCIL ERASERS,KITTY PENCIL ERASERS,2.55,,0,1,BUNNY-WOODEN-PAINTED-WITH-BIRD-,21896,18/05/2020 00:00
2063,BUNNY WOODEN PAINTED WITH BIRD ,BUNNY WOODEN PAINTED WITH BIRD ,3.39,,0,1,WRAP-GREEN-RUSSIAN-FOLKART-,16202E,25/01/2020 00:00
2064,WRAP GREEN RUSSIAN FOLKART ,WRAP GREEN RUSSIAN FOLKART ,2.75,,0,1,LILY-BROOCH-OLIVE-COLOUR,22265,21/10/2020 00:00
2065,LILY BROOCH OLIVE COLOUR,LILY BROOCH OLIVE COLOUR,1.06,,0,1,POPART-RECT-PENCIL-SHARPENER-ASST,47420,19/04/2020 00:00
2066,POPART RECT PENCIL SHARPENER ASST,POPART RECT PENCIL SHARPENER ASST,1.06,,0,1,LARGE-TORTILLA-DESIGN-RED-BOWL,22510,02/10/2020 00:00
2067,LARGE TORTILLA DESIGN RED BOWL,LARGE TORTILLA DESIGN RED BOWL,1.06,,0,1,YELLOW-METAL-CHICKEN-HEART-,48116,16/10/2020 00:00
2068,YELLOW METAL CHICKEN HEART ,YELLOW METAL CHICKEN HEART ,1.06,,0,1,BLUE-KNITTED-HEN-,72709,01/04/2020 00:00
2069,BLUE KNITTED HEN ,BLUE KNITTED HEN ,4.95,,0,1,CANDY-SPOT-HEART-DECORATION,72132,05/09/2020 00:00
2070,CANDY SPOT HEART DECORATION,CANDY SPOT HEART DECORATION,6.95,,0,1,PICNIC-BOXES-SET-OF-3-RETROSPOT-,85118,30/11/2020 00:00
2071,PICNIC BOXES SET OF 3 RETROSPOT ,PICNIC BOXES SET OF 3 RETROSPOT ,2.1,,0,1,BOTTLE-BAG-RETROSPOT-,35968,21/04/2020 00:00
2072,BOTTLE BAG RETROSPOT ,BOTTLE BAG RETROSPOT ,2.55,,0,1,GREEN-GOOSE-FEATHER-CHRISTMAS-TREE-,22063,05/05/2020 00:00
2073,GREEN GOOSE FEATHER CHRISTMAS TREE ,GREEN GOOSE FEATHER CHRISTMAS TREE ,1.65,,0,1,HOLLY-TOP-CHRISTMAS-STOCKING,90184B,24/12/2020 00:00
2074,HOLLY TOP CHRISTMAS STOCKING,HOLLY TOP CHRISTMAS STOCKING,3.39,,0,1,FLOWER-PURPLE-CLOCK-W-SUCKER,90184A,21/05/2020 00:00
2075,FLOWER PURPLE CLOCK W/SUCKER,FLOWER PURPLE CLOCK W/SUCKER,3.39,,0,1,SKULLS-DESIGN-FLANNEL,84415B,21/04/2020 00:00
2076,SKULLS DESIGN FLANNEL,SKULLS DESIGN FLANNEL,7.65,,0,1,ORIGAMI-ROSE-INCENSE-CANDLE-SET-,20906,03/09/2020 00:00
2077,ORIGAMI ROSE INCENSE/CANDLE SET ,ORIGAMI ROSE INCENSE/CANDLE SET ,4.25,,0,1,ORIGAMI-JASMINE-INCENSE-CANDLE-SET,20703,15/06/2020 00:00
2078,ORIGAMI JASMINE INCENSE/CANDLE SET,ORIGAMI JASMINE INCENSE/CANDLE SET,1.85,,0,1,ORIGAMI-OPIUM-INCENSE-CANDLE-SET-,90173,08/08/2020 00:00
2079,ORIGAMI OPIUM INCENSE/CANDLE SET ,ORIGAMI OPIUM INCENSE/CANDLE SET ,1.85,,0,1,ORIGAMI-SANDLEWOOD-INCENSE-CAND-SET,22513,24/01/2020 00:00
2080,ORIGAMI SANDLEWOOD INCENSE/CAND SET,ORIGAMI SANDLEWOOD INCENSE/CAND SET,2.1,,0,1,TALL-ROCOCO-CANDLE-HOLDER,71496A,29/02/2020 00:00
2081,TALL ROCOCO CANDLE HOLDER,TALL ROCOCO CANDLE HOLDER,2.1,,0,1,MINI-CAKE-STAND-HANGING-STRAWBERY,71495B,03/10/2020 00:00
2082,MINI CAKE STAND  HANGING STRAWBERY,MINI CAKE STAND  HANGING STRAWBERY,2.1,,0,1,FRUIT-TREE-AND-BIRDS-WALL-PLAQUE,78124,14/02/2020 00:00
2083,FRUIT TREE AND BIRDS WALL PLAQUE,FRUIT TREE AND BIRDS WALL PLAQUE,2.1,,0,1,SPRIG-LAVENDER-ARTIFICIAL-FLOWER,37500,23/11/2020 00:00
2084,SPRIG LAVENDER ARTIFICIAL FLOWER,SPRIG LAVENDER ARTIFICIAL FLOWER,0.85,,0,1,SET-OF-3-PINK-FLYING-DUCKS,22166,24/03/2020 00:00
2085,SET OF 3 PINK FLYING DUCKS,SET OF 3 PINK FLYING DUCKS,1.25,,0,1,PAINTED-PINK-RABBIT-,22145,05/04/2020 00:00
2086,PAINTED PINK RABBIT ,PAINTED PINK RABBIT ,1.45,,0,1,FRYING-PAN-BLUE-POLKADOT,22163,28/06/2020 00:00
2087,FRYING PAN BLUE POLKADOT,FRYING PAN BLUE POLKADOT,4.65,,0,1,PINK-POLKADOT-GARDEN-PARASOL,20761,15/05/2020 00:00
2088,PINK POLKADOT GARDEN PARASOL,PINK POLKADOT GARDEN PARASOL,2.95,,0,1,ENCHANTED-BIRD-PLANT-CAGE,22138,26/08/2020 00:00
2089,ENCHANTED BIRD PLANT CAGE,ENCHANTED BIRD PLANT CAGE,1.25,,0,1,PAPERWEIGHT-VINTAGE-COLLAGE,85230G,28/09/2020 00:00
2090,PAPERWEIGHT VINTAGE COLLAGE,PAPERWEIGHT VINTAGE COLLAGE,2.55,,0,1,PAPERWEIGHT-HOME-SWEET-HOME,35833P,09/11/2020 00:00
2091,PAPERWEIGHT HOME SWEET HOME,PAPERWEIGHT HOME SWEET HOME,1.25,,0,1,STRAWBRY-SCENTED-VOTIVE-CANDLE,71215,08/11/2020 00:00
2092,STRAWBRY SCENTED VOTIVE CANDLE,STRAWBRY SCENTED VOTIVE CANDLE,0.55,,0,1,LOVE-SEAT-ANTIQUE-WHITE-METAL,20886,27/03/2020 00:00
2093,LOVE SEAT ANTIQUE WHITE METAL,LOVE SEAT ANTIQUE WHITE METAL,1.25,,0,1,DOG-BOWL-VINTAGE-CREAM,20695,25/10/2020 00:00
2094,DOG BOWL VINTAGE CREAM,DOG BOWL VINTAGE CREAM,2.55,,0,1,MIRROR-MOSAIC-GOBLET-CANDLE-HOLDER,20892,22/01/2020 00:00
2095,MIRROR MOSAIC GOBLET CANDLE HOLDER,MIRROR MOSAIC GOBLET CANDLE HOLDER,3.39,,0,1,MIRROR-MOSAIC-T-LIGHT-HOLDER-,22324,09/10/2020 00:00
2096,MIRROR MOSAIC T-LIGHT HOLDER ,MIRROR MOSAIC T-LIGHT HOLDER ,2.75,,0,1,RATTLE-SNAKE-EGGS,22820,09/04/2020 00:00
2097,RATTLE SNAKE EGGS,RATTLE SNAKE EGGS,1.06,,0,1,MINI-HIGHLIGHTER-PENS,16168M,20/11/2020 00:00
2098,MINI HIGHLIGHTER PENS,MINI HIGHLIGHTER PENS,1.06,,0,1,SILVER-PHOTO-FRAME,84952A,04/01/2020 00:00
2099,SILVER PHOTO FRAME,SILVER PHOTO FRAME,1.06,,0,1,GOLD-PHOTO-FRAME,21846,10/08/2020 00:00
2100,GOLD PHOTO FRAME,GOLD PHOTO FRAME,1.06,,0,1,LIPSTICK-PEN-BABY-PINK,84706D,06/09/2020 00:00
2101,LIPSTICK PEN BABY PINK,LIPSTICK PEN BABY PINK,4.95,,0,1,KITTENS-DESIGN-FLANNEL,22828,25/09/2020 00:00
2102,KITTENS DESIGN FLANNEL,KITTENS DESIGN FLANNEL,6.95,,0,1,FRENCH-BLUE-METAL-DOOR-SIGN-2,21066,22/02/2020 00:00
2103,FRENCH BLUE METAL DOOR SIGN 2,FRENCH BLUE METAL DOOR SIGN 2,2.1,,0,1,SET-OF-4-POLKADOT-PLACEMATS-,21281,23/03/2020 00:00
2104,SET OF 4 POLKADOT PLACEMATS ,SET OF 4 POLKADOT PLACEMATS ,2.55,,0,1,CRYSTAL-HOOP-EARRING-FLORAL-LEAF,22703,09/10/2020 00:00
2105,CRYSTAL HOOP EARRING FLORAL LEAF,CRYSTAL HOOP EARRING FLORAL LEAF,1.65,,0,1,SILVER-AMETHYST-DROP-EARRINGS-LEAF,21684,05/10/2020 00:00
2106,SILVER/AMETHYST DROP EARRINGS LEAF,SILVER/AMETHYST DROP EARRINGS LEAF,3.39,,0,1,CRYSTAL-PAIR-HEART-HAIR-SLIDES,84247L,01/05/2020 00:00
2107,CRYSTAL PAIR HEART HAIR SLIDES,CRYSTAL PAIR HEART HAIR SLIDES,3.39,,0,1,MIDNIGHT-BLUE-PAIR-HEART-HAIR-SLIDE,85170C,14/08/2020 00:00
2108,MIDNIGHT BLUE PAIR HEART HAIR SLIDE,MIDNIGHT BLUE PAIR HEART HAIR SLIDE,4.25,,0,1,PINK-VINTAGE-VICTORIAN-EARRINGS,22516,05/03/2020 00:00
2109,PINK VINTAGE VICTORIAN EARRINGS,PINK VINTAGE VICTORIAN EARRINGS,2.1,,0,1,ROSE-COLOUR-PAIR-HEART-HAIR-SLIDES,22523,26/04/2020 00:00
2110,ROSE COLOUR PAIR HEART HAIR SLIDES,ROSE COLOUR PAIR HEART HAIR SLIDES,0.42,,0,1,RETROSPOT-CANDLE-MEDIUM,22521,29/03/2020 00:00
2111,RETROSPOT CANDLE  MEDIUM,RETROSPOT CANDLE  MEDIUM,0.42,,0,1,SMALL-TALL-CAMPHOR-WOOD-TOADSTOOL,22698,10/09/2020 00:00
2112,SMALL TALL CAMPHOR WOOD TOADSTOOL,SMALL TALL CAMPHOR WOOD TOADSTOOL,0.85,,0,1,BLOSSOM-IMAGES-GIFT-WRAP-SET,85053,13/04/2020 00:00
2113,BLOSSOM IMAGES GIFT WRAP SET,BLOSSOM IMAGES GIFT WRAP SET,3.75,,0,1,ASSORTED-EASTER-GIFT-TAGS,84875B,25/03/2020 00:00
2114,ASSORTED EASTER GIFT TAGS,ASSORTED EASTER GIFT TAGS,1.25,,0,1,ENVELOPE-50-BLOSSOM-IMAGES,84876D,05/06/2020 00:00
2115,ENVELOPE 50 BLOSSOM IMAGES,ENVELOPE 50 BLOSSOM IMAGES,0.42,,0,1,EASTER-TIN-KEEPSAKE,90211B,11/12/2020 00:00
2116,EASTER TIN KEEPSAKE,EASTER TIN KEEPSAKE,0.42,,0,1,EASTER-TIN-CHICKS-IN-GARDEN,84192,08/09/2020 00:00
2117,EASTER TIN CHICKS IN GARDEN,EASTER TIN CHICKS IN GARDEN,1.25,,0,1,JIGSAW-TOADSTOOLS-3-PIECE,21628,08/02/2020 00:00
2118,JIGSAW TOADSTOOLS 3 PIECE,JIGSAW TOADSTOOLS 3 PIECE,0.42,,0,1,EASTER-TIN-BUCKET,22254,18/02/2020 00:00
2119,EASTER TIN BUCKET,EASTER TIN BUCKET,0.42,,0,1,BLUE-TILED-TRAY,21615,11/03/2020 00:00
2120,BLUE TILED TRAY,BLUE TILED TRAY,1.65,,0,1,ASSORTED-LAQUERED-INCENSE-HOLDERS,22236,22/12/2020 00:00
2121,ASSORTED LAQUERED INCENSE HOLDERS,ASSORTED LAQUERED INCENSE HOLDERS,1.25,,0,1,CARTOON-PENCIL-SHARPENERS,22933,25/01/2020 00:00
2122,CARTOON  PENCIL SHARPENERS,CARTOON  PENCIL SHARPENERS,2.95,,0,1,TROPICAL-HOLIDAY-PURSE-,85107,09/11/2020 00:00
2123,TROPICAL HOLIDAY PURSE ,TROPICAL HOLIDAY PURSE ,1.65,,0,1,CAROUSEL-PONIES-BABY-BIB,22741,14/06/2020 00:00
2124,CAROUSEL PONIES BABY BIB,CAROUSEL PONIES BABY BIB,9.95,,0,1,VIP-HOLIDAY-PURSE,21051,08/08/2020 00:00
2125,VIP HOLIDAY PURSE,VIP HOLIDAY PURSE,0.85,,0,1,CAKES-AND-RABBITS-DESIGN-FLANNEL-,21382,30/09/2020 00:00
2126,CAKES AND RABBITS DESIGN FLANNEL ,CAKES AND RABBITS DESIGN FLANNEL ,1.85,,0,1,PARTY-TIME-DESIGN-FLANNEL,44234,18/05/2020 00:00
2127,PARTY TIME DESIGN FLANNEL,PARTY TIME DESIGN FLANNEL,1.85,,0,1,ECONOMY-HOLIDAY-PURSE,75131,12/04/2020 00:00
2128,ECONOMY HOLIDAY PURSE,ECONOMY HOLIDAY PURSE,1.95,,0,1,OLD-DOC-RUSSEL-METAL-SIGN,40003,28/07/2020 00:00
2129,OLD DOC RUSSEL METAL SIGN,OLD DOC RUSSEL METAL SIGN,0.29,,0,1,NINJA-RABBIT-PINK,79190B,28/08/2020 00:00
2130,NINJA RABBIT PINK,NINJA RABBIT PINK,9.95,,0,1,BLUE-SHARK-HELICOPTER,90036D,16/07/2020 00:00
2131,BLUE SHARK HELICOPTER,BLUE SHARK HELICOPTER,8.5,,0,1,GREEN-WIRE-STANDING-CANDLE-HOLDER,21535,05/11/2020 00:00
2132,GREEN WIRE STANDING CANDLE HOLDER,GREEN WIRE STANDING CANDLE HOLDER,4.65,,0,1,ROMANTIC-IMAGES-SCRAP-BOOK-SET,16015,13/01/2020 00:00
2133,ROMANTIC IMAGES SCRAP BOOK SET,ROMANTIC IMAGES SCRAP BOOK SET,9.95,,0,1,MINI-JIGSAW-PURDEY,16008,31/03/2020 00:00
2134,MINI JIGSAW PURDEY,MINI JIGSAW PURDEY,1.95,,0,1,LETTER-SHAPE-PENCIL-SHARPENER,21284,05/03/2020 00:00
2135,LETTER SHAPE PENCIL SHARPENER,LETTER SHAPE PENCIL SHARPENER,7.65,,0,1,BLACK-STITCHED-WALL-CLOCK,37444B,26/10/2020 00:00
2136,BLACK STITCHED WALL CLOCK,BLACK STITCHED WALL CLOCK,2.55,,0,1,DOOR-HANGER-MUM-DADS-ROOM,37333,10/10/2020 00:00
2137,DOOR HANGER  MUM + DADS ROOM,DOOR HANGER  MUM + DADS ROOM,4.65,,0,1,QUEEN-OF-THE-SKIES-HOLIDAY-PURSE-,20778,03/09/2020 00:00
2138,QUEEN OF THE SKIES HOLIDAY PURSE ,QUEEN OF THE SKIES HOLIDAY PURSE ,5.95,,0,1,GOLD-SCROLL-GLASS-T-LIGHT-HOLDER,20758,29/02/2020 00:00
2139,GOLD SCROLL GLASS T-LIGHT HOLDER,GOLD SCROLL GLASS T-LIGHT HOLDER,9.95,,0,1,GLASS-JAR-MARMALADE-,85039B,19/08/2020 00:00
2140,GLASS JAR MARMALADE ,GLASS JAR MARMALADE ,3.39,,0,1,PINK-BUTTERFLY-WASHBAG,85040B,31/05/2020 00:00
2141,PINK BUTTERFLY WASHBAG,PINK BUTTERFLY WASHBAG,1.25,,0,1,S-4-PINK-FLOWER-CANDLES-IN-BOWL,22319,06/12/2020 00:00
2142,S/4 PINK FLOWER CANDLES IN BOWL,S/4 PINK FLOWER CANDLES IN BOWL,1.25,,0,1,FLOWER-GLASS-GARLD-NECKL36AMETHYST,22824,07/09/2020 00:00
2143,"FLOWER GLASS GARLD NECKL36""AMETHYST","FLOWER GLASS GARLD NECKL36""AMETHYST",4.25,,0,1,PURPLE-BOUDICCA-LARGE-BRACELET,17084N,28/09/2020 00:00
2144,PURPLE BOUDICCA LARGE BRACELET,PURPLE BOUDICCA LARGE BRACELET,1.25,,0,1,RED-BOUDICCA-LARGE-BRACELET,17084P,21/02/2020 00:00
2145,RED BOUDICCA LARGE BRACELET,RED BOUDICCA LARGE BRACELET,5.95,,0,1,ANT-COPPER-TURQ-BOUDICCA-BRACELET,21128,21/05/2020 00:00
