id,title,Description,price,image,featured,active,slug,stockcode,timestamp
10,WHITE HANGING HEART T-LIGHT HOLDER,WHITE HANGING HEART T-LIGHT HOLDER,2.55,,0,1,WHITE-HANGING-HEART-T-LIGHT-HOLDER,71053,19/07/2020 00:00
11,WHITE METAL LANTERN,WHITE METAL LANTERN,3.39,,0,1,WHITE-METAL-LANTERN,22632,23/08/2020 00:00
12,CREAM CUPID HEARTS COAT HANGER,CREAM CUPID HEARTS COAT HANGER,2.75,,0,1,CREAM-CUPID-HEARTS-COAT-HANGER,22900,28/01/2020 00:00
13,KNITTED UNION FLAG HOT WATER BOTTLE,KNITTED UNION FLAG HOT WATER BOTTLE,3.39,,0,1,KNITTED-UNION-FLAG-HOT-WATER-BOTTLE,82486,29/04/2020 00:00
14,RED WOOLLY HOTTIE WHITE HEART.,RED WOOLLY HOTTIE WHITE HEART.,3.39,,0,1,RED-WOOLLY-HOTTIE-WHITE-HEART,84997B,23/04/2020 00:00
15,SET 7 BABUSHKA NESTING BOXES,SET 7 BABUSHKA NESTING BOXES,7.65,,0,1,SET-7-BABUSHKA-NESTING-BOXES,84997C,26/08/2020 00:00
16,GLASS STAR FROSTED T-LIGHT HOLDER,GLASS STAR FROSTED T-LIGHT HOLDER,4.25,,0,1,GLASS-STAR-FROSTED-T-LIGHT-HOLDER,20725,31/07/2020 00:00
17,HAND WARMER UNION JACK,HAND WARMER UNION JACK,1.85,,0,1,HAND-WARMER-UNION-JACK,22778,06/05/2020 00:00
18,HAND WARMER RED POLKA DOT,HAND WARMER RED POLKA DOT,1.85,,0,1,HAND-WARMER-RED-POLKA-DOT,22466,22/12/2020 00:00
19,ASSORTED COLOUR BIRD ORNAMENT,ASSORTED COLOUR BIRD ORNAMENT,1.69,,0,1,ASSORTED-COLOUR-BIRD-ORNAMENT,22963,03/09/2020 00:00
20,POPPY'S PLAYHOUSE BEDROOM ,POPPY'S PLAYHOUSE BEDROOM ,2.1,,0,1,POPPYS-PLAYHOUSE-BEDROOM-,22197,12/09/2020 00:00
21,POPPY'S PLAYHOUSE KITCHEN,POPPY'S PLAYHOUSE KITCHEN,2.1,,0,1,POPPYS-PLAYHOUSE-KITCHEN,22502,17/05/2020 00:00
22,FELTCRAFT PRINCESS CHARLOTTE DOLL,FELTCRAFT PRINCESS CHARLOTTE DOLL,3.75,,0,1,FELTCRAFT-PRINCESS-CHARLOTTE-DOLL,21232,20/03/2020 00:00
23,IVORY KNITTED MUG COSY ,IVORY KNITTED MUG COSY ,1.65,,0,1,IVORY-KNITTED-MUG-COSY-,22804,17/01/2020 00:00
24,BOX OF 6 ASSORTED COLOUR TEASPOONS,BOX OF 6 ASSORTED COLOUR TEASPOONS,4.25,,0,1,BOX-OF-6-ASSORTED-COLOUR-TEASPOONS,22837,09/01/2020 00:00
25,BOX OF VINTAGE JIGSAW BLOCKS ,BOX OF VINTAGE JIGSAW BLOCKS ,4.95,,0,1,BOX-OF-VINTAGE-JIGSAW-BLOCKS-,22383,21/05/2020 00:00
26,BOX OF VINTAGE ALPHABET BLOCKS,BOX OF VINTAGE ALPHABET BLOCKS,9.95,,0,1,BOX-OF-VINTAGE-ALPHABET-BLOCKS,20914,27/08/2020 00:00
27,HOME BUILDING BLOCK WORD,HOME BUILDING BLOCK WORD,5.95,,0,1,HOME-BUILDING-BLOCK-WORD,22813,04/10/2020 00:00
28,LOVE BUILDING BLOCK WORD,LOVE BUILDING BLOCK WORD,5.95,,0,1,LOVE-BUILDING-BLOCK-WORD,22812,07/08/2020 00:00
29,RECIPE BOX WITH METAL HEART,RECIPE BOX WITH METAL HEART,7.95,,0,1,RECIPE-BOX-WITH-METAL-HEART,22785,21/03/2020 00:00
30,DOORMAT NEW ENGLAND,DOORMAT NEW ENGLAND,7.95,,0,1,DOORMAT-NEW-ENGLAND,22972,10/09/2020 00:00
31,JAM MAKING SET WITH JARS,JAM MAKING SET WITH JARS,4.25,,0,1,JAM-MAKING-SET-WITH-JARS,21811,13/11/2020 00:00
32,RED COAT RACK PARIS FASHION,RED COAT RACK PARIS FASHION,4.95,,0,1,RED-COAT-RACK-PARIS-FASHION,84906,09/02/2020 00:00
33,YELLOW COAT RACK PARIS FASHION,YELLOW COAT RACK PARIS FASHION,4.95,,0,1,YELLOW-COAT-RACK-PARIS-FASHION,21243,25/11/2020 00:00
34,BLUE COAT RACK PARIS FASHION,BLUE COAT RACK PARIS FASHION,4.95,,0,1,BLUE-COAT-RACK-PARIS-FASHION,22179,03/09/2020 00:00
35,BATH BUILDING BLOCK WORD,BATH BUILDING BLOCK WORD,5.95,,0,1,BATH-BUILDING-BLOCK-WORD,85184C,30/06/2020 00:00
36,ALARM CLOCK BAKELIKE PINK,ALARM CLOCK BAKELIKE PINK,3.75,,0,1,ALARM-CLOCK-BAKELIKE-PINK,22952,20/01/2020 00:00
37,ALARM CLOCK BAKELIKE RED ,ALARM CLOCK BAKELIKE RED ,3.75,,0,1,ALARM-CLOCK-BAKELIKE-RED-,22595,07/12/2020 00:00
38,ALARM CLOCK BAKELIKE GREEN,ALARM CLOCK BAKELIKE GREEN,3.75,,0,1,ALARM-CLOCK-BAKELIKE-GREEN,84997D,02/05/2020 00:00
39,PANDA AND BUNNIES STICKER SHEET,PANDA AND BUNNIES STICKER SHEET,0.85,,0,1,PANDA-AND-BUNNIES-STICKER-SHEET,22776,11/05/2020 00:00
40,STARS GIFT TAPE ,STARS GIFT TAPE ,0.65,,0,1,STARS-GIFT-TAPE-,22584,04/07/2020 00:00
41,INFLATABLE POLITICAL GLOBE ,INFLATABLE POLITICAL GLOBE ,0.85,,0,1,INFLATABLE-POLITICAL-GLOBE-,82600,23/06/2020 00:00
42,VINTAGE HEADS AND TAILS CARD GAME ,VINTAGE HEADS AND TAILS CARD GAME ,1.25,,0,1,VINTAGE-HEADS-AND-TAILS-CARD-GAME-,21928,17/05/2020 00:00
43,SET/2 RED RETROSPOT TEA TOWELS ,SET/2 RED RETROSPOT TEA TOWELS ,2.95,,0,1,SET-2-RED-RETROSPOT-TEA-TOWELS-,22597,07/12/2020 00:00
44,ROUND SNACK BOXES SET OF4 WOODLAND ,ROUND SNACK BOXES SET OF4 WOODLAND ,2.95,,0,1,ROUND-SNACK-BOXES-SET-OF4-WOODLAND-,22953,24/05/2020 00:00
45,SPACEBOY LUNCH BOX ,SPACEBOY LUNCH BOX ,1.95,,0,1,SPACEBOY-LUNCH-BOX-,22847,15/10/2020 00:00
46,LUNCH BOX I LOVE LONDON,LUNCH BOX I LOVE LONDON,1.95,,0,1,LUNCH-BOX-I-LOVE-LONDON,21818,11/02/2020 00:00
47,CIRCUS PARADE LUNCH BOX ,CIRCUS PARADE LUNCH BOX ,1.95,,0,1,CIRCUS-PARADE-LUNCH-BOX-,22965,17/11/2020 00:00
48,CHARLOTTE BAG DOLLY GIRL DESIGN,CHARLOTTE BAG DOLLY GIRL DESIGN,0.85,,0,1,CHARLOTTE-BAG-DOLLY-GIRL-DESIGN,84997A,27/08/2020 00:00
49,RED TOADSTOOL LED NIGHT LIGHT,RED TOADSTOOL LED NIGHT LIGHT,1.65,,0,1,RED-TOADSTOOL-LED-NIGHT-LIGHT,71477,29/02/2020 00:00
50, SET 2 TEA TOWELS I LOVE LONDON , SET 2 TEA TOWELS I LOVE LONDON ,2.95,,0,1,-SET-2-TEA-TOWELS-I-LOVE-LONDON-,22135,11/11/2020 00:00
51,VINTAGE SEASIDE JIGSAW PUZZLES,VINTAGE SEASIDE JIGSAW PUZZLES,3.75,,0,1,VINTAGE-SEASIDE-JIGSAW-PUZZLES,22602,26/04/2020 00:00
52,MINI JIGSAW CIRCUS PARADE ,MINI JIGSAW CIRCUS PARADE ,0.42,,0,1,MINI-JIGSAW-CIRCUS-PARADE-,22777,29/03/2020 00:00
53,MINI JIGSAW SPACEBOY,MINI JIGSAW SPACEBOY,0.42,,0,1,MINI-JIGSAW-SPACEBOY,22896,22/07/2020 00:00
54,MINI PAINT SET VINTAGE ,MINI PAINT SET VINTAGE ,0.65,,0,1,MINI-PAINT-SET-VINTAGE-,22285,21/12/2020 00:00
55,POSTAGE,POSTAGE,18,,0,1,POSTAGE,22849,06/09/2020 00:00
56,PAPER CHAIN KIT 50'S CHRISTMAS ,PAPER CHAIN KIT 50'S CHRISTMAS ,2.55,,0,1,PAPER-CHAIN-KIT-50S-CHRISTMAS-,22986,26/11/2020 00:00
57,EDWARDIAN PARASOL RED,EDWARDIAN PARASOL RED,1.85,,0,1,EDWARDIAN-PARASOL-RED,84946,30/06/2020 00:00
58,RETRO COFFEE MUGS ASSORTED,RETRO COFFEE MUGS ASSORTED,1.85,,0,1,RETRO-COFFEE-MUGS-ASSORTED,21899,31/05/2020 00:00
59,SAVE THE PLANET MUG,SAVE THE PLANET MUG,2.55,,0,1,SAVE-THE-PLANET-MUG,85185B,04/07/2020 00:00
60,VINTAGE BILLBOARD DRINK ME MUG,VINTAGE BILLBOARD DRINK ME MUG,3.39,,0,1,VINTAGE-BILLBOARD-DRINK-ME-MUG,22985,01/12/2020 00:00
61,VINTAGE BILLBOARD LOVE/HATE MUG,VINTAGE BILLBOARD LOVE/HATE MUG,2.75,,0,1,VINTAGE-BILLBOARD-LOVE-HATE-MUG,21507,01/04/2020 00:00
62,WOOD 2 DRAWER CABINET WHITE FINISH,WOOD 2 DRAWER CABINET WHITE FINISH,4.95,,0,1,WOOD-2-DRAWER-CABINET-WHITE-FINISH,71459,25/06/2020 00:00
63,WOOD S/3 CABINET ANT WHITE FINISH,WOOD S/3 CABINET ANT WHITE FINISH,1.06,,0,1,WOOD-S-3-CABINET-ANT-WHITE-FINISH,85144,15/07/2020 00:00
64,WOODEN PICTURE FRAME WHITE FINISH,WOODEN PICTURE FRAME WHITE FINISH,1.06,,0,1,WOODEN-PICTURE-FRAME-WHITE-FINISH,17107D,31/01/2020 00:00
65,WOODEN FRAME ANTIQUE WHITE ,WOODEN FRAME ANTIQUE WHITE ,1.06,,0,1,WOODEN-FRAME-ANTIQUE-WHITE-,22246,01/01/2020 00:00
66,VICTORIAN SEWING BOX LARGE,VICTORIAN SEWING BOX LARGE,1.06,,0,1,VICTORIAN-SEWING-BOX-LARGE,21112,16/08/2020 00:00
67,HOT WATER BOTTLE TEA AND SYMPATHY,HOT WATER BOTTLE TEA AND SYMPATHY,4.95,,0,1,HOT-WATER-BOTTLE-TEA-AND-SYMPATHY,47310M,13/03/2020 00:00
68,RED HANGING HEART T-LIGHT HOLDER,RED HANGING HEART T-LIGHT HOLDER,6.95,,0,1,RED-HANGING-HEART-T-LIGHT-HOLDER,22939,21/06/2020 00:00
69,JUMBO BAG PINK POLKADOT,JUMBO BAG PINK POLKADOT,2.1,,0,1,JUMBO-BAG-PINK-POLKADOT,22129,17/08/2020 00:00
70,JUMBO  BAG BAROQUE BLACK WHITE,JUMBO  BAG BAROQUE BLACK WHITE,2.55,,0,1,JUMBO-BAG-BAROQUE-BLACK-WHITE,21109,28/11/2020 00:00
71,JUMBO BAG CHARLIE AND LOLA TOYS,JUMBO BAG CHARLIE AND LOLA TOYS,3.39,,0,1,JUMBO-BAG-CHARLIE-AND-LOLA-TOYS,22199,20/05/2020 00:00
72,STRAWBERRY CHARLOTTE BAG,STRAWBERRY CHARLOTTE BAG,3.39,,0,1,STRAWBERRY-CHARLOTTE-BAG,22134,08/04/2020 00:00
73,RED 3 PIECE RETROSPOT CUTLERY SET,RED 3 PIECE RETROSPOT CUTLERY SET,7.65,,0,1,RED-3-PIECE-RETROSPOT-CUTLERY-SET,22949,18/10/2020 00:00
74,BLUE 3 PIECE POLKADOT CUTLERY SET,BLUE 3 PIECE POLKADOT CUTLERY SET,4.25,,0,1,BLUE-3-PIECE-POLKADOT-CUTLERY-SET,79030D,12/07/2020 00:00
75,SET/6 RED SPOTTY PAPER PLATES,SET/6 RED SPOTTY PAPER PLATES,10.95,,0,1,SET-6-RED-SPOTTY-PAPER-PLATES,79030G,31/03/2020 00:00
76,LUNCH BAG RED RETROSPOT,LUNCH BAG RED RETROSPOT,2.55,,0,1,LUNCH-BAG-RED-RETROSPOT,79051A,15/03/2020 00:00
77,STRAWBERRY LUNCH BOX WITH CUTLERY,STRAWBERRY LUNCH BOX WITH CUTLERY,3.39,,0,1,STRAWBERRY-LUNCH-BOX-WITH-CUTLERY,84247E,08/03/2020 00:00
78,LUNCH BOX WITH CUTLERY RETROSPOT ,LUNCH BOX WITH CUTLERY RETROSPOT ,2.75,,0,1,LUNCH-BOX-WITH-CUTLERY-RETROSPOT-,82001S,18/04/2020 00:00
79,PACK OF 72 RETROSPOT CAKE CASES,PACK OF 72 RETROSPOT CAKE CASES,4.95,,0,1,PACK-OF-72-RETROSPOT-CAKE-CASES,22932,23/05/2020 00:00
80,PACK OF 60 DINOSAUR CAKE CASES,PACK OF 60 DINOSAUR CAKE CASES,1.06,,0,1,PACK-OF-60-DINOSAUR-CAKE-CASES,22937,03/07/2020 00:00
81,PACK OF 60 PINK PAISLEY CAKE CASES,PACK OF 60 PINK PAISLEY CAKE CASES,1.06,,0,1,PACK-OF-60-PINK-PAISLEY-CAKE-CASES,84828,09/07/2020 00:00
82,60 TEATIME FAIRY CAKE CASES,60 TEATIME FAIRY CAKE CASES,1.06,,0,1,60-TEATIME-FAIRY-CAKE-CASES,44235,15/07/2020 00:00
83,TOMATO CHARLIE+LOLA COASTER SET,TOMATO CHARLIE+LOLA COASTER SET,1.06,,0,1,TOMATO-CHARLIELOLA-COASTER-SET,22416,06/06/2020 00:00
84,CHARLIE & LOLA WASTEPAPER BIN FLORA,CHARLIE & LOLA WASTEPAPER BIN FLORA,4.95,,0,1,CHARLIE-LOLA-WASTEPAPER-BIN-FLORA,84228,15/01/2020 00:00
85,RED CHARLIE+LOLA PERSONAL DOORSIGN,RED CHARLIE+LOLA PERSONAL DOORSIGN,6.95,,0,1,RED-CHARLIELOLA-PERSONAL-DOORSIGN,81950V,19/08/2020 00:00
86,JUMBO STORAGE BAG SUKI,JUMBO STORAGE BAG SUKI,2.1,,0,1,JUMBO-STORAGE-BAG-SUKI,90014B,23/10/2020 00:00
87,JUMBO BAG PINK VINTAGE PAISLEY,JUMBO BAG PINK VINTAGE PAISLEY,2.55,,0,1,JUMBO-BAG-PINK-VINTAGE-PAISLEY,20622,18/05/2020 00:00
88,JAM MAKING SET PRINTED,JAM MAKING SET PRINTED,3.39,,0,1,JAM-MAKING-SET-PRINTED,35817P,09/06/2020 00:00
89,RETROSPOT TEA SET CERAMIC 11 PC ,RETROSPOT TEA SET CERAMIC 11 PC ,3.39,,0,1,RETROSPOT-TEA-SET-CERAMIC-11-PC-,22407,03/11/2020 00:00
90,GIRLY PINK TOOL SET,GIRLY PINK TOOL SET,7.65,,0,1,GIRLY-PINK-TOOL-SET,90014A,22/10/2020 00:00
91,JUMBO SHOPPER VINTAGE RED PAISLEY,JUMBO SHOPPER VINTAGE RED PAISLEY,4.25,,0,1,JUMBO-SHOPPER-VINTAGE-RED-PAISLEY,22286,31/12/2020 00:00
92,"AIRLINE LOUNGE,METAL SIGN","AIRLINE LOUNGE,METAL SIGN",3.45,,0,1,AIRLINE-LOUNGEMETAL-SIGN,16156L,30/08/2020 00:00
93,WHITE SPOT RED CERAMIC DRAWER KNOB,WHITE SPOT RED CERAMIC DRAWER KNOB,2.55,,0,1,WHITE-SPOT-RED-CERAMIC-DRAWER-KNOB,22268,24/03/2020 00:00
94,RED DRAWER KNOB ACRYLIC EDWARDIAN,RED DRAWER KNOB ACRYLIC EDWARDIAN,1.85,,0,1,RED-DRAWER-KNOB-ACRYLIC-EDWARDIAN,23231,12/04/2020 00:00
95,CLEAR DRAWER KNOB ACRYLIC EDWARDIAN,CLEAR DRAWER KNOB ACRYLIC EDWARDIAN,1.85,,0,1,CLEAR-DRAWER-KNOB-ACRYLIC-EDWARDIAN,22287,11/01/2020 00:00
96,PHOTO CLIP LINE,PHOTO CLIP LINE,1.95,,0,1,PHOTO-CLIP-LINE,23232,16/05/2020 00:00
97,FELT EGG COSY CHICKEN,FELT EGG COSY CHICKEN,1.95,,0,1,FELT-EGG-COSY-CHICKEN,22999,18/11/2020 00:00
98,PIGGY BANK RETROSPOT ,PIGGY BANK RETROSPOT ,2.95,,0,1,PIGGY-BANK-RETROSPOT-,23194,17/09/2020 00:00
99,SKULL SHOULDER BAG,SKULL SHOULDER BAG,0.85,,0,1,SKULL-SHOULDER-BAG,23126,07/01/2020 00:00
100,YOU'RE CONFUSING ME METAL SIGN ,YOU'RE CONFUSING ME METAL SIGN ,3.75,,0,1,YOURE-CONFUSING-ME-METAL-SIGN-,23127,13/11/2020 00:00
101,COOK WITH WINE METAL SIGN ,COOK WITH WINE METAL SIGN ,3.75,,0,1,COOK-WITH-WINE-METAL-SIGN-,23128,24/06/2020 00:00
102,GIN + TONIC DIET METAL SIGN,GIN + TONIC DIET METAL SIGN,0.85,,0,1,GIN-TONIC-DIET-METAL-SIGN,23254,22/03/2020 00:00
103,YELLOW BREAKFAST CUP AND SAUCER,YELLOW BREAKFAST CUP AND SAUCER,1.65,,0,1,YELLOW-BREAKFAST-CUP-AND-SAUCER,23256,17/03/2020 00:00
104,PINK BREAKFAST CUP AND SAUCER ,PINK BREAKFAST CUP AND SAUCER ,2.55,,0,1,PINK-BREAKFAST-CUP-AND-SAUCER-,23205,14/01/2020 00:00
105,PAPER CHAIN KIT RETROSPOT,PAPER CHAIN KIT RETROSPOT,2.55,,0,1,PAPER-CHAIN-KIT-RETROSPOT,23065,02/01/2020 00:00
106,SMALL HEART FLOWERS HOOK ,SMALL HEART FLOWERS HOOK ,0.42,,0,1,SMALL-HEART-FLOWERS-HOOK-,23057,02/10/2020 00:00
107,TEA TIME DES TEA COSY,TEA TIME DES TEA COSY,0.55,,0,1,TEA-TIME-DES-TEA-COSY,23066,24/07/2020 00:00
108,FELT EGG COSY WHITE RABBIT ,FELT EGG COSY WHITE RABBIT ,0.55,,0,1,FELT-EGG-COSY-WHITE-RABBIT-,23068,18/11/2020 00:00
109,ZINC WILLIE WINKIE  CANDLE STICK,ZINC WILLIE WINKIE  CANDLE STICK,0.55,,0,1,ZINC-WILLIE-WINKIE-CANDLE-STICK,23075,26/11/2020 00:00
110,CERAMIC CHERRY CAKE MONEY BANK,CERAMIC CHERRY CAKE MONEY BANK,2.95,,0,1,CERAMIC-CHERRY-CAKE-MONEY-BANK,23061,28/02/2020 00:00
111,RETROSPOT LARGE MILK JUG,RETROSPOT LARGE MILK JUG,1.25,,0,1,RETROSPOT-LARGE-MILK-JUG,23056,24/10/2020 00:00
112,SET OF 6 FUNKY BEAKERS,SET OF 6 FUNKY BEAKERS,0.38,,0,1,SET-OF-6-FUNKY-BEAKERS,23071,15/08/2020 00:00
113,EDWARDIAN PARASOL BLACK,EDWARDIAN PARASOL BLACK,1.95,,0,1,EDWARDIAN-PARASOL-BLACK,23148,03/12/2020 00:00
114,EDWARDIAN PARASOL NATURAL,EDWARDIAN PARASOL NATURAL,1.95,,0,1,EDWARDIAN-PARASOL-NATURAL,23145,21/09/2020 00:00
115,CERAMIC STRAWBERRY CAKE MONEY BANK,CERAMIC STRAWBERRY CAKE MONEY BANK,1.45,,0,1,CERAMIC-STRAWBERRY-CAKE-MONEY-BANK,23253,24/11/2020 00:00
116,BLUE OWL SOFT TOY,BLUE OWL SOFT TOY,4.25,,0,1,BLUE-OWL-SOFT-TOY,23131,28/04/2020 00:00
117,BALLOON ART MAKE YOUR OWN FLOWERS,BALLOON ART MAKE YOUR OWN FLOWERS,4.95,,0,1,BALLOON-ART-MAKE-YOUR-OWN-FLOWERS,23283,12/07/2020 00:00
118,GLASS CLOCHE SMALL,GLASS CLOCHE SMALL,1.95,,0,1,GLASS-CLOCHE-SMALL,23041,25/10/2020 00:00
119,GUMBALL MONOCHROME COAT RACK,GUMBALL MONOCHROME COAT RACK,2.1,,0,1,GUMBALL-MONOCHROME-COAT-RACK,23040,28/05/2020 00:00
120,DOORMAT FANCY FONT HOME SWEET HOME,DOORMAT FANCY FONT HOME SWEET HOME,1.25,,0,1,DOORMAT-FANCY-FONT-HOME-SWEET-HOME,23130,23/03/2020 00:00
121,Discount,Discount,1.25,,0,1,Discount,23299,16/04/2020 00:00
122,VINTAGE SNAKES & LADDERS,VINTAGE SNAKES & LADDERS,1.25,,0,1,VINTAGE-SNAKES-LADDERS,23298,01/03/2020 00:00
123,CHOCOLATE CALCULATOR,CHOCOLATE CALCULATOR,1.25,,0,1,CHOCOLATE-CALCULATOR,23043,28/05/2020 00:00
124,RECYCLING BAG RETROSPOT ,RECYCLING BAG RETROSPOT ,0.85,,0,1,RECYCLING-BAG-RETROSPOT-,23045,18/01/2020 00:00
125,TOY TIDY PINK POLKADOT,TOY TIDY PINK POLKADOT,2.55,,0,1,TOY-TIDY-PINK-POLKADOT,23209,23/07/2020 00:00
126,ANTIQUE GLASS DRESSING TABLE POT,ANTIQUE GLASS DRESSING TABLE POT,1.65,,0,1,ANTIQUE-GLASS-DRESSING-TABLE-POT,23203,05/12/2020 00:00
127,IVORY GIANT GARDEN THERMOMETER,IVORY GIANT GARDEN THERMOMETER,1.69,,0,1,IVORY-GIANT-GARDEN-THERMOMETER,23047,29/09/2020 00:00
128,3 TIER CAKE TIN GREEN AND CREAM,3 TIER CAKE TIN GREEN AND CREAM,1.95,,0,1,3-TIER-CAKE-TIN-GREEN-AND-CREAM,23044,07/09/2020 00:00
129,3 TIER CAKE TIN RED AND CREAM,3 TIER CAKE TIN RED AND CREAM,2.1,,0,1,3-TIER-CAKE-TIN-RED-AND-CREAM,23282,31/10/2020 00:00
130,SET 3 WICKER OVAL BASKETS W LIDS,SET 3 WICKER OVAL BASKETS W LIDS,2.95,,0,1,SET-3-WICKER-OVAL-BASKETS-W-LIDS,23280,26/11/2020 00:00
131,SET OF 3 COLOURED  FLYING DUCKS,SET OF 3 COLOURED  FLYING DUCKS,2.95,,0,1,SET-OF-3-COLOURED-FLYING-DUCKS,23191,13/01/2020 00:00
132,WOOD BLACK BOARD ANT WHITE FINISH,WOOD BLACK BOARD ANT WHITE FINISH,2.95,,0,1,WOOD-BLACK-BOARD-ANT-WHITE-FINISH,23081,25/02/2020 00:00
133,COLOUR GLASS T-LIGHT HOLDER HANGING,COLOUR GLASS T-LIGHT HOLDER HANGING,2.95,,0,1,COLOUR-GLASS-T-LIGHT-HOLDER-HANGING,23281,29/04/2020 00:00
134,HANGING METAL HEART LANTERN,HANGING METAL HEART LANTERN,0.85,,0,1,HANGING-METAL-HEART-LANTERN,23091,20/05/2020 00:00
135,HANGING MEDINA LANTERN SMALL,HANGING MEDINA LANTERN SMALL,1.25,,0,1,HANGING-MEDINA-LANTERN-SMALL,23109,02/05/2020 00:00
136,NATURAL SLATE HEART CHALKBOARD ,NATURAL SLATE HEART CHALKBOARD ,2.55,,0,1,NATURAL-SLATE-HEART-CHALKBOARD-,23103,11/11/2020 00:00
137,HEART OF WICKER SMALL,HEART OF WICKER SMALL,0.85,,0,1,HEART-OF-WICKER-SMALL,23079,25/08/2020 00:00
138,HEART OF WICKER LARGE,HEART OF WICKER LARGE,0.85,,0,1,HEART-OF-WICKER-LARGE,23104,13/03/2020 00:00
139,WHITE LOVEBIRD LANTERN,WHITE LOVEBIRD LANTERN,1.45,,0,1,WHITE-LOVEBIRD-LANTERN,23168,01/11/2020 00:00
140,CLASSIC METAL BIRDCAGE PLANT HOLDER,CLASSIC METAL BIRDCAGE PLANT HOLDER,4.95,,0,1,CLASSIC-METAL-BIRDCAGE-PLANT-HOLDER,23169,22/04/2020 00:00
141,CREAM HEART CARD HOLDER,CREAM HEART CARD HOLDER,2.95,,0,1,CREAM-HEART-CARD-HOLDER,23107,02/10/2020 00:00
142,ENAMEL FLOWER JUG CREAM,ENAMEL FLOWER JUG CREAM,5.95,,0,1,ENAMEL-FLOWER-JUG-CREAM,23106,05/11/2020 00:00
143,ENAMEL FIRE BUCKET CREAM,ENAMEL FIRE BUCKET CREAM,5.95,,0,1,ENAMEL-FIRE-BUCKET-CREAM,23086,16/01/2020 00:00
144,ENAMEL BREAD BIN CREAM,ENAMEL BREAD BIN CREAM,1.45,,0,1,ENAMEL-BREAD-BIN-CREAM,23214,14/08/2020 00:00
145,JUMBO BAG DOLLY GIRL DESIGN,JUMBO BAG DOLLY GIRL DESIGN,2.95,,0,1,JUMBO-BAG-DOLLY-GIRL-DESIGN,23212,24/06/2020 00:00
146,TRADITIONAL CHRISTMAS RIBBONS,TRADITIONAL CHRISTMAS RIBBONS,1.95,,0,1,TRADITIONAL-CHRISTMAS-RIBBONS,23306,29/09/2020 00:00
147,ORGANISER WOOD ANTIQUE WHITE ,ORGANISER WOOD ANTIQUE WHITE ,1.65,,0,1,ORGANISER-WOOD-ANTIQUE-WHITE-,23240,21/03/2020 00:00
148,LUNCH BAG DOLLY GIRL DESIGN,LUNCH BAG DOLLY GIRL DESIGN,3.95,,0,1,LUNCH-BAG-DOLLY-GIRL-DESIGN,23236,17/11/2020 00:00
149,WHITE WIRE EGG HOLDER,WHITE WIRE EGG HOLDER,1.06,,0,1,WHITE-WIRE-EGG-HOLDER,23235,01/04/2020 00:00
150,JUMBO BAG RED RETROSPOT,JUMBO BAG RED RETROSPOT,6.75,,0,1,JUMBO-BAG-RED-RETROSPOT,23244,09/10/2020 00:00
151,CHILLI LIGHTS,CHILLI LIGHTS,27.5,,0,1,CHILLI-LIGHTS,23237,31/07/2020 00:00
152,LIGHT GARLAND BUTTERFILES PINK,LIGHT GARLAND BUTTERFILES PINK,0.85,,0,1,LIGHT-GARLAND-BUTTERFILES-PINK,22950,15/08/2020 00:00
153,WOODEN OWLS LIGHT GARLAND ,WOODEN OWLS LIGHT GARLAND ,3.75,,0,1,WOODEN-OWLS-LIGHT-GARLAND-,23252,30/03/2020 00:00
154,FAIRY TALE COTTAGE NIGHTLIGHT,FAIRY TALE COTTAGE NIGHTLIGHT,1.65,,0,1,FAIRY-TALE-COTTAGE-NIGHTLIGHT,23271,21/05/2020 00:00
155,HOME SMALL WOOD LETTERS,HOME SMALL WOOD LETTERS,1.95,,0,1,HOME-SMALL-WOOD-LETTERS,23292,09/05/2020 00:00
156,GINGHAM HEART  DOORSTOP RED,GINGHAM HEART  DOORSTOP RED,2.1,,0,1,GINGHAM-HEART-DOORSTOP-RED,23188,03/07/2020 00:00
157,FIVE HEART HANGING DECORATION,FIVE HEART HANGING DECORATION,1.85,,0,1,FIVE-HEART-HANGING-DECORATION,23251,07/07/2020 00:00
158,ASSORTED BOTTLE TOP  MAGNETS ,ASSORTED BOTTLE TOP  MAGNETS ,2.95,,0,1,ASSORTED-BOTTLE-TOP-MAGNETS-,23249,20/07/2020 00:00
159,FRIDGE MAGNETS US DINER ASSORTED,FRIDGE MAGNETS US DINER ASSORTED,3.75,,0,1,FRIDGE-MAGNETS-US-DINER-ASSORTED,23250,28/03/2020 00:00
160,HOMEMADE JAM SCENTED CANDLES,HOMEMADE JAM SCENTED CANDLES,5.95,,0,1,HOMEMADE-JAM-SCENTED-CANDLES,23229,22/01/2020 00:00
161,FRIDGE MAGNETS LES ENFANTS ASSORTED,FRIDGE MAGNETS LES ENFANTS ASSORTED,14.95,,0,1,FRIDGE-MAGNETS-LES-ENFANTS-ASSORTED,23035,22/12/2020 00:00
162,ROSE CARAVAN DOORSTOP,ROSE CARAVAN DOORSTOP,14.95,,0,1,ROSE-CARAVAN-DOORSTOP,23020,11/11/2020 00:00
163,5 HOOK HANGER MAGIC TOADSTOOL,5 HOOK HANGER MAGIC TOADSTOOL,16.95,,0,1,5-HOOK-HANGER-MAGIC-TOADSTOOL,23032,21/11/2020 00:00
164,CHRISTMAS LIGHTS 10 REINDEER,CHRISTMAS LIGHTS 10 REINDEER,4.65,,0,1,CHRISTMAS-LIGHTS-10-REINDEER,23028,15/01/2020 00:00
165,VINTAGE UNION JACK CUSHION COVER,VINTAGE UNION JACK CUSHION COVER,6.45,,0,1,VINTAGE-UNION-JACK-CUSHION-COVER,23031,17/11/2020 00:00
166,SET OF 3 GOLD FLYING DUCKS,SET OF 3 GOLD FLYING DUCKS,0.65,,0,1,SET-OF-3-GOLD-FLYING-DUCKS,23029,14/11/2020 00:00
167,RED RETROSPOT UMBRELLA,RED RETROSPOT UMBRELLA,1.65,,0,1,RED-RETROSPOT-UMBRELLA,23015,04/11/2020 00:00
168,BLACK/BLUE POLKADOT UMBRELLA,BLACK/BLUE POLKADOT UMBRELLA,2.95,,0,1,BLACK-BLUE-POLKADOT-UMBRELLA,23197,24/08/2020 00:00
169,RED DINER WALL CLOCK,RED DINER WALL CLOCK,2.95,,0,1,RED-DINER-WALL-CLOCK,23196,14/08/2020 00:00
170,BLUE DINER WALL CLOCK,BLUE DINER WALL CLOCK,1.45,,0,1,BLUE-DINER-WALL-CLOCK,23342,20/08/2020 00:00
171,IVORY DINER WALL CLOCK,IVORY DINER WALL CLOCK,2.55,,0,1,IVORY-DINER-WALL-CLOCK,23545,15/05/2020 00:00
172,LARGE HEART MEASURING SPOONS,LARGE HEART MEASURING SPOONS,2.95,,0,1,LARGE-HEART-MEASURING-SPOONS,23360,19/04/2020 00:00
173,SMALL HEART MEASURING SPOONS,SMALL HEART MEASURING SPOONS,12.75,,0,1,SMALL-HEART-MEASURING-SPOONS,23359,26/12/2020 00:00
174,JAM JAR WITH PINK LID,JAM JAR WITH PINK LID,3.95,,0,1,JAM-JAR-WITH-PINK-LID,23436,19/10/2020 00:00
175,JAM JAR WITH GREEN LID,JAM JAR WITH GREEN LID,5.95,,0,1,JAM-JAR-WITH-GREEN-LID,23438,15/02/2020 00:00
176,ROSE COTTAGE KEEPSAKE BOX ,ROSE COTTAGE KEEPSAKE BOX ,6.95,,0,1,ROSE-COTTAGE-KEEPSAKE-BOX-,23324,31/07/2020 00:00
177,HANGING HEART ZINC T-LIGHT HOLDER,HANGING HEART ZINC T-LIGHT HOLDER,10.95,,0,1,HANGING-HEART-ZINC-T-LIGHT-HOLDER,23325,14/04/2020 00:00
178,PAPER CHAIN KIT VINTAGE CHRISTMAS,PAPER CHAIN KIT VINTAGE CHRISTMAS,19.95,,0,1,PAPER-CHAIN-KIT-VINTAGE-CHRISTMAS,23437,14/08/2020 00:00
179,DISCO BALL CHRISTMAS DECORATION,DISCO BALL CHRISTMAS DECORATION,1.45,,0,1,DISCO-BALL-CHRISTMAS-DECORATION,23396,14/01/2020 00:00
180,SMALL POPCORN HOLDER,SMALL POPCORN HOLDER,4.25,,0,1,SMALL-POPCORN-HOLDER,23380,09/01/2020 00:00
181,LARGE POPCORN HOLDER ,LARGE POPCORN HOLDER ,1.95,,0,1,LARGE-POPCORN-HOLDER-,23402,16/12/2020 00:00
182,SET/20 RED RETROSPOT PAPER NAPKINS ,SET/20 RED RETROSPOT PAPER NAPKINS ,1.25,,0,1,SET-20-RED-RETROSPOT-PAPER-NAPKINS-,23413,25/07/2020 00:00
183,SET/6 RED SPOTTY PAPER CUPS,SET/6 RED SPOTTY PAPER CUPS,8.5,,0,1,SET-6-RED-SPOTTY-PAPER-CUPS,23391,23/10/2020 00:00
184,POLKADOT RAIN HAT ,POLKADOT RAIN HAT ,1.65,,0,1,POLKADOT-RAIN-HAT-,23390,29/12/2020 00:00
185,DELUXE SEWING KIT ,DELUXE SEWING KIT ,4.95,,0,1,DELUXE-SEWING-KIT-,23389,29/05/2020 00:00
186,RETROSPOT HEART HOT WATER BOTTLE,RETROSPOT HEART HOT WATER BOTTLE,1.65,,0,1,RETROSPOT-HEART-HOT-WATER-BOTTLE,23388,05/06/2020 00:00
187,ENGLISH ROSE HOT WATER BOTTLE,ENGLISH ROSE HOT WATER BOTTLE,1.65,,0,1,ENGLISH-ROSE-HOT-WATER-BOTTLE,23366,11/07/2020 00:00
188,PHOTO CUBE,PHOTO CUBE,3.82,,0,1,PHOTO-CUBE,23502,13/02/2020 00:00
189,PLASTERS IN TIN CIRCUS PARADE ,PLASTERS IN TIN CIRCUS PARADE ,3.37,,0,1,PLASTERS-IN-TIN-CIRCUS-PARADE-,23370,07/09/2020 00:00
190,PACK OF 12 PINK PAISLEY TISSUES ,PACK OF 12 PINK PAISLEY TISSUES ,3.37,,0,1,PACK-OF-12-PINK-PAISLEY-TISSUES-,23466,01/01/2021 00:00
191,PACK OF 12 BLUE PAISLEY TISSUES ,PACK OF 12 BLUE PAISLEY TISSUES ,1.45,,0,1,PACK-OF-12-BLUE-PAISLEY-TISSUES-,23484,10/12/2020 00:00
192,PACK OF 12 RED RETROSPOT TISSUES ,PACK OF 12 RED RETROSPOT TISSUES ,1.25,,0,1,PACK-OF-12-RED-RETROSPOT-TISSUES-,23524,20/06/2020 00:00
193,CHICK GREY HOT WATER BOTTLE,CHICK GREY HOT WATER BOTTLE,5.95,,0,1,CHICK-GREY-HOT-WATER-BOTTLE,23535,31/01/2020 00:00
194,PLASTERS IN TIN VINTAGE PAISLEY ,PLASTERS IN TIN VINTAGE PAISLEY ,5.95,,0,1,PLASTERS-IN-TIN-VINTAGE-PAISLEY-,23534,13/11/2020 00:00
195,PLASTERS IN TIN SKULLS,PLASTERS IN TIN SKULLS,7.95,,0,1,PLASTERS-IN-TIN-SKULLS,23541,12/05/2020 00:00
196,3 STRIPEY MICE FELTCRAFT,3 STRIPEY MICE FELTCRAFT,4.95,,0,1,3-STRIPEY-MICE-FELTCRAFT,23539,18/05/2020 00:00
197,SET OF 6 SOLDIER SKITTLES,SET OF 6 SOLDIER SKITTLES,4.25,,0,1,SET-OF-6-SOLDIER-SKITTLES,23522,18/10/2020 00:00
198,TRADITIONAL WOODEN SKIPPING ROPE,TRADITIONAL WOODEN SKIPPING ROPE,2.95,,0,1,TRADITIONAL-WOODEN-SKIPPING-ROPE,23526,03/04/2020 00:00
199,WOODEN BOX OF DOMINOES,WOODEN BOX OF DOMINOES,1.65,,0,1,WOODEN-BOX-OF-DOMINOES,23542,30/09/2020 00:00
200,RUSTIC  SEVENTEEN DRAWER SIDEBOARD,RUSTIC  SEVENTEEN DRAWER SIDEBOARD,0.42,,0,1,RUSTIC-SEVENTEEN-DRAWER-SIDEBOARD,23528,14/06/2020 00:00
201,PARTY CONES CARNIVAL ASSORTED,PARTY CONES CARNIVAL ASSORTED,0.85,,0,1,PARTY-CONES-CARNIVAL-ASSORTED,23543,22/11/2020 00:00
202,PARTY CONES CANDY ASSORTED,PARTY CONES CANDY ASSORTED,1.45,,0,1,PARTY-CONES-CANDY-ASSORTED,23530,18/11/2020 00:00
203,PICNIC BASKET WICKER SMALL,PICNIC BASKET WICKER SMALL,0.85,,0,1,PICNIC-BASKET-WICKER-SMALL,23521,24/08/2020 00:00
204,STAR DECORATION PAINTED ZINC ,STAR DECORATION PAINTED ZINC ,6.75,,0,1,STAR-DECORATION-PAINTED-ZINC-,23523,05/02/2020 00:00
205,RETROSPOT LAMP,RETROSPOT LAMP,1.65,,0,1,RETROSPOT-LAMP,23527,03/12/2020 00:00
206,"FANCY FONT BIRTHDAY CARD, ","FANCY FONT BIRTHDAY CARD, ",1.65,,0,1,FANCY-FONT-BIRTHDAY-CARD-,23529,12/04/2020 00:00
207,HAND WARMER SCOTTY DOG DESIGN,HAND WARMER SCOTTY DOG DESIGN,8.5,,0,1,HAND-WARMER-SCOTTY-DOG-DESIGN,23536,04/07/2020 00:00
208,HAND WARMER OWL DESIGN,HAND WARMER OWL DESIGN,4.95,,0,1,HAND-WARMER-OWL-DESIG-,23525,29/07/2020 00:00
209,HAND WARMER RED RETROSPOT,HAND WARMER RED RETROSPOT,1.25,,0,1,HAND-WARMER-RED-RETROSPOT,23540,15/05/2020 00:00
210,DOG BOWL CHASING BALL DESIGN,DOG BOWL CHASING BALL DESIGN,5.45,,0,1,DOG-BOWL-CHASING-BALL-DESIGN,23537,22/09/2020 00:00
211,CLOTHES PEGS RETROSPOT PACK 24 ,CLOTHES PEGS RETROSPOT PACK 24 ,6.35,,0,1,CLOTHES-PEGS-RETROSPOT-PACK-24-,23465,23/05/2020 00:00
212,HAND OVER THE CHOCOLATE   SIGN ,HAND OVER THE CHOCOLATE   SIGN ,5.95,,0,1,HAND-OVER-THE-CHOCOLATE-SIGN-,23456,27/11/2020 00:00
213,TRAVEL SEWING KIT,TRAVEL SEWING KIT,5.95,,0,1,TRAVEL-SEWING-KIT,23457,09/05/2020 00:00
214,BLACK HEART CARD HOLDER,BLACK HEART CARD HOLDER,8.5,,0,1,BLACK-HEART-CARD-HOLDER,23455,21/05/2020 00:00
215,SMALL GLASS HEART TRINKET POT,SMALL GLASS HEART TRINKET POT,3.75,,0,1,SMALL-GLASS-HEART-TRINKET-POT,23489,12/07/2020 00:00
216,ALARM CLOCK BAKELIKE IVORY,ALARM CLOCK BAKELIKE IVORY,3.75,,0,1,ALARM-CLOCK-BAKELIKE-IVORY,23462,21/12/2020 00:00
217,ALARM CLOCK BAKELIKE ORANGE,ALARM CLOCK BAKELIKE ORANGE,8.5,,0,1,ALARM-CLOCK-BAKELIKE-ORANGE,23454,05/05/2020 00:00
218,HAND WARMER BIRD DESIGN,HAND WARMER BIRD DESIGN,8.5,,0,1,HAND-WARMER-BIRD-DESIGN,23497,23/06/2020 00:00
219,IVORY EMBROIDERED QUILT ,IVORY EMBROIDERED QUILT ,1.65,,0,1,IVORY-EMBROIDERED-QUILT-,23691,13/06/2020 00:00
220,SET OF 3 BLACK FLYING DUCKS,SET OF 3 BLACK FLYING DUCKS,0.85,,0,1,SET-OF-3-BLACK-FLYING-DUCKS,85123A,17/03/2020 00:00
221,RED RETROSPOT MUG,RED RETROSPOT MUG,8.5,,0,1,RED-RETROSPOT-MUG,84406B,14/04/2020 00:00
222,BABUSHKA LIGHTS STRING OF 10,BABUSHKA LIGHTS STRING OF 10,3.75,,0,1,BABUSHKA-LIGHTS-STRING-OF-10,84029G,16/10/2020 00:00
223,DOORMAT FAIRY CAKE,DOORMAT FAIRY CAKE,1.45,,0,1,DOORMAT-FAIRY-CAKE,84029E,22/03/2020 00:00
224,STRAWBERRY CERAMIC TRINKET BOX,STRAWBERRY CERAMIC TRINKET BOX,0.72,,0,1,STRAWBERRY-CERAMIC-TRINKET-BOX,22752,08/09/2020 00:00
225,PINK DOUGHNUT TRINKET POT ,PINK DOUGHNUT TRINKET POT ,0.72,,0,1,PINK-DOUGHNUT-TRINKET-POT-,21730,29/08/2020 00:00
